idx,disease,Symptom,reason,TestsAndProcedures,commonMedications
405,Premature ovarian failure,"['Infertility', 'Unpredictable menstruation', 'Absence of menstruation', 'Pelvic pain', 'Weight gain', 'Heavy menstrual flow', 'Hot flashes', 'Intermenstrual bleeding', 'Lack of growth', 'Dry or flaky scalp', 'Too little hair', 'Pain during intercourse']","Premature Ovarian Failure (POF), also known as premature ovarian insufficiency, primary ovarian insufficiency (this is the most accurate term as some women may still conceive), premature menopause, hypergonadotropic hypogonadism, is the loss of function of the ovaries before age 40. A commonly cited triad for the diagnosis is amenorrhea, hypergonadotropinism, and hypoestrogenism. If it has a genetic cause, it may be called gonadal dysgenesis ","['Radiographic imaging procedure', 'Hematologic tests (Blood test)', 'Ultrasonography (Ultrasound)', 'Pelvis exam', 'Examination of breast', 'Standard pregnancy test', 'Rectal examination']","['Human Chorionic Gonadotropin (Hcg)', 'Clomiphene (Clomid)', 'Medroxyprogesterone', 'Estradiol', 'Estrogens, Conjugated (Usp) (Premarin)', 'Progesterone', 'Leuprolide (Lupron)', 'Menotropins (Hmg)', 'Letrozole (Femara)', 'Danazol']"
406,Thoracic outlet syndrome,"['Neck pain', 'Arm pain', 'Shoulder pain', 'Loss of sensation', 'Paresthesia', 'Sharp chest pain', 'Weakness', 'Hand or finger weakness', 'Back pain', 'Hand or finger pain', 'Shoulder weakness', 'Decreased appetite']","Thoracic outlet syndrome (TOS) is a syndrome involving compression at the superior thoracic outlet wherein excess pressure placed on a neurovascular bundle passing between the anterior scalene and middle scalene muscles. It can affect one or more of the nerves that innervate the upper limb and/or blood vessels as they pass between the chest and upper extremity; specifically in the brachial plexus, the subclavian artery, and - rarely - the subclavian vein, which does not normally pass through the scalene hiatus. ","['Physical therapy exercises (Exercises)', 'Other diagnostic procedures (interview; evaluation; consultation)', 'Other physical therapy and rehabilitation', 'Magnetic resonance imaging (Mri)', 'Other therapeutic procedures', 'Thyroidectomy; partial or complete', 'Cardiac stress tests']","['Gabapentin', 'Pregabalin (Lyrica)', 'Glatiramer (Copaxone)', 'Codeine', 'Letrozole (Femara)', 'Pyridoxine', 'Leuprolide (Lupron)', 'Metaxalone (Skelaxin)']"
407,Ganglion cyst,"['Knee pain', 'Leg pain', 'Wrist pain', 'Skin growth', 'Wrist lump or mass', 'Hand or finger lump or mass', 'Hand or finger pain', 'Foot or toe pain', 'Knee lump or mass', 'Leg swelling', 'Knee swelling', 'Wrist swelling']","A ganglion cyst, also known as a Bible cyst or Bible bump, is a benign soft tissue tumor that may occur in any joint, but most often occurs on or around joints and tendons in the hands or feet. ","['Radiographic imaging procedure', 'Plain x-ray (X ray)', 'Complete physical skin exam performed (ML)', 'Magnetic resonance imaging (Mri)', 'Excision (Removal)', 'Wound care management', 'Physical therapy exercises (Exercises)']","['Piroxicam', 'Goldenseal Preparation', 'Aluminum Sulfate Topical', 'Penbutolol (Levatol)', 'Thrombin Topical', 'Ethyl Chloride Topical', 'Ceftizoxime', 'Trolamine Salicylate Topical', 'Lysine', 'Fenofibric Acid (Trilipix)', 'Hydrocortisone-Pramoxine Topical']"
408,Dislocation of the knee,"['Knee pain', 'Shoulder pain', 'Knee swelling', 'Joint pain', 'Knee stiffness or tightness']",Slippage of the FEMUR off the TIBIA. ,"['Radiographic imaging procedure', 'Plain x-ray (X ray)', 'Application of splint (Splinting)', 'Physical therapy exercises (Exercises)', 'Magnetic resonance imaging (Mri)', 'Other diagnostic procedures (interview; evaluation; consultation)', 'Electroencephalogram (EEG) (Eeg)']","['Triamcinolone Topical Product', 'Triamterene', 'Glucosamine', 'Bupivacaine', 'Mecamylamine', 'Grepafloxacin (Raxar)', 'Malathion Topical', 'Gemtuzumab (Mylotarg)', 'Gadoteridol (Prohance)']"
409,Crohn disease,"['Sharp abdominal pain', 'Diarrhea', 'Vomiting', 'Nausea', 'Burning abdominal pain', 'Blood in stool', 'Rectal bleeding', 'Pain of the anus', 'Joint pain', 'Stomach bloating', 'Heartburn', 'Regurgitation']","Crohn\'s disease, also known as Crohn syndrome and regional enteritis, is a type of inflammatory bowel disease that may affect any part of the gastrointestinal tract from mouth to anus, causing a wide variety of symptoms. It primarily causes abdominal pain, diarrhea (which may be bloody if inflammation is at its worst), vomiting (can be continuous), or weight loss, but may also cause complications outside the gastrointestinal tract such as skin rashes, arthritis, inflammation of the eye, tiredness, and lack of concentration. Crohn\'s disease is caused by interactions between environmental, immunological and bacterial factors in genetically susceptible individuals. This results in a chronic inflammatory disorder, in which the body\'s immune system attacks the gastrointestinal tract possibly directed at microbial antigens. Crohn\'s disease has wrongly been described as an autoimmune disease in the past; recent investigators have described it as an immune deficiency state. ","['Hematologic tests (Blood test)', 'Complete blood count (Cbc)', 'Urinalysis', 'Glucose measurement (Glucose level)', 'Intravenous fluid replacement', 'Kidney function tests (Kidney function test)', 'Electrolytes panel']","['Mesalamine (Asacol)', 'Infliximab (Remicade)', 'Azathioprine', 'Metronidazole', 'Vitamin B 12', 'Sulfasalazine', 'Mercaptopurine', 'Loperamide (Imodium)', 'Budesonide', 'Dicyclomine', 'Adalimumab (Humira)']"
410,Postoperative infection,"['Fever', 'Abnormal appearing skin', 'Sharp abdominal pain', 'Skin on leg or foot looks infected', 'Skin swelling', 'Fluid retention', 'Leg swelling', 'Skin on arm or hand looks infected', 'Jaw swelling', 'Recent pregnancy', 'Fluid in ear', 'Irregular belly button']"," zosyn, ","['Wound care management', 'Hematologic tests (Blood test)', 'Complete blood count (Cbc)', 'Intravenous fluid replacement', 'Complete physical skin exam performed (ML)', 'Glucose measurement (Glucose level)', 'Electrolytes panel']","['Vancomycin', 'Zosyn', 'Iodine Topical', 'Daptomycin', 'Mafenide Topical', 'Sodium Hypochlorite Topical', 'Rifampin', 'Cellulose', 'Cefadroxil', 'Treprostinil (Remodulin)', 'Gentamicin Topical', 'Hyaluronidase']"
411,Folate deficiency,"['Shortness of breath', 'Sharp chest pain', 'Sharp abdominal pain', 'Weakness', 'Difficulty breathing', 'Fatigue', 'Vomiting blood', 'Melena', 'Delusions or hallucinations', 'Joint pain', 'Problems during pregnancy', 'Increased heart rate']",Folate deficiency is a lack of folic acid in the diet and the signs are often subtle. Folate deficiency anemia is the medical name given for the condition. ,"['Hematologic tests (Blood test)', 'Complete blood count (Cbc)', 'Electrolytes panel', 'Glucose measurement (Glucose level)', 'Urinalysis', 'Kidney function tests (Kidney function test)', 'Electrocardiogram']","['Vitamin B 12', 'Folic Acid', 'Pioglitazone (Actos)', 'Darbepoetin Alfa (Aranesp)', 'Nebivolol (Bystolic)', 'Epoetin Alfa (Procrit)', 'Fosinopril', 'Doxazosin', 'Opium', 'Butalbital (G-1)', 'Clomipramine']"
412,Fluid overload,"['Shortness of breath', 'Peripheral edema', 'Sharp abdominal pain', 'Fluid retention', 'Leg swelling', 'Nausea', 'Difficulty breathing', 'Vomiting', 'Weakness', 'Cough', 'Sharp chest pain', 'Hand or finger swelling']","Hypervolemia, or fluid overload, is the medical condition where there is too much fluid in the blood. The opposite condition is hypovolemia, which is too little fluid volume in the blood. Fluid volume excess in the intravascular compartment occurs due to an increase in total body sodium content and a consequent increase in extracellular body water. The mechanism usually stems from compromised regulatory mechanisms for sodium handling as seen in congestive heart failure (CHF), kidney failure, and liver failure. It may also be caused by excessive intake of sodium from foods, intravenous (IV) solutions and blood transfusions, medications, or diagnostic contrast dyes. ","['Hematologic tests (Blood test)', 'Complete blood count (Cbc)', 'Radiographic imaging procedure', 'Electrocardiogram', 'Plain x-ray (X ray)', 'Glucose measurement (Glucose level)', 'Kidney function tests (Kidney function test)']","['Furosemide', 'Clonidine', 'Sodium Bicarbonate', 'Heparin', 'Sodium Polystyrene Sulfonate (Kayexalate)', 'Tacrolimus (Prograf)', 'Vancomycin', 'Minoxidil (Rogaine)', 'Torsemide', 'Epoetin Alfa (Procrit)', 'Mycophenolate Mofetil (Cellcept)']"
413,Atrial flutter,"['Irregular heartbeat', 'Increased heart rate', 'Palpitations', 'Shortness of breath', 'Sharp chest pain', 'Difficulty breathing', 'Dizziness', 'Fatigue', 'Chest tightness', 'Frequent urination', 'Swollen lymph nodes', 'Feeling hot']","Atrial flutter (AFL) is an abnormal heart rhythm that occurs in the atria of the heart. When it first occurs, it is usually associated with a fast heart rate or tachycardia (beats over 100 per minute), and falls into the category of supra-ventricular tachycardias. While this rhythm occurs most often in individuals with cardiovascular disease (e.g. hypertension, coronary artery disease, and cardiomyopathy) and diabetes, it may occur spontaneously in people with otherwise normal hearts. It is typically not a stable rhythm, and frequently degenerates into atrial fibrillation (AF). However, it does rarely persist for months to years. ","['Electrocardiogram', 'Hematologic tests (Blood test)', 'Radiographic imaging procedure', 'Complete blood count (Cbc)', 'Electrolytes panel', 'Glucose measurement (Glucose level)', 'Kidney function tests (Kidney function test)']","['Warfarin', 'Furosemide', 'Diltiazem', 'Digoxin', 'Carvedilol', 'Amiodarone', 'Sotalol', 'Spironolactone', 'Enoxaparin (Lovenox)', 'Flecainide', 'Propafenone', 'Adenosine']"
414,Skin disorder,"['Skin lesion', 'Abnormal appearing skin', 'Skin rash', 'Skin moles', 'Skin growth', 'Skin swelling', 'Itching of skin', 'Acne or pimples', 'Skin dryness, peeling, scaliness, or roughness', 'Irregular appearing scalp', 'Warts', 'Skin irritation']","A cutaneous condition is any medical condition that affects the integumentary system \xe2\x80\x94 the organ system that encloses the body and includes skin, hair, nails, and related muscle and glands. The major function of this system is as a barrier against the external environment. ","['Complete physical skin exam performed (ML)', 'Excision (Removal)', 'Wound care management', 'Biopsy', 'Excision of skin lesion', 'Other diagnostic procedures on skin and subcutaneous tissue', 'Lipid panel']","['Clobetasol Topical', 'Tretinoin Topical', 'Fluocinonide Topical', 'Silver Nitrate Topical Each', 'Fluorouracil', 'Imiquimod Topical', 'Fluorouracil Topical', 'Benzoyl Peroxide-Erythromycin Topical', 'Benzoyl Peroxide-Clindamycin Topical', 'Lactic Acid Topical', 'Hydroquinone Topical']"
415,Floaters,"['Spots or clouds in vision', 'Diminished vision', 'Lacrimation', 'Pain in eye', 'Symptoms of eye', 'Itchiness of eye', 'Eye burns or stings', 'Foreign body sensation in eye']","Floaters are deposits of various size, shape, consistency, refractive index, and motility within the eye\xe2\x80\x99s vitreous humour, which is normally transparent. At a young age, the vitreous is transparent, but as one ages, imperfections gradually develop. The common type of floater, which is present in most people\xe2\x80\x99s eyes, is due to degenerative changes of the vitreous humour. The perception of floaters is known as myodesopsia, or less commonly as myodaeopsia, myiodeopsia, myiodesopsia. They are also called Muscae volitantes (Latin: ""flying flies""), or mouches volantes (from the French). Floaters are visible because of the shadows they cast on the retina or refraction of the light that passes through them, and can appear alone or together with several others in one\xe2\x80\x99s visual field. They may appear as spots, threads, or fragments of cobwebs, which float slowly before the observer\xe2\x80\x99s eyes. Since these objects exist within the eye itself, they are not optical illusions but are entoptic phenomena. ","['Ophthalmic examination and evaluation (Eye exam)', 'Other intraocular therapeutic procedures', 'Other therapeutic procedures on eyelids; conjunctiva; cornea', 'Ophthalmologic and otologic diagnosis and treatment', 'Biopsy']","['Tropicamide Ophthalmic', 'Phenylephrine (Duramax)', 'Benoxinate-Fluorescein Ophthalmic', 'Ocular Lubricant', 'Loteprednol Ophthalmic', 'Fluorescein Ophthalmic', 'Cyclosporine Ophthalmic', 'Timolol', 'Teriparatide (Forteo)', 'Colestipol', 'Methyl Salicylate-Menthol Topical']"
416,Tooth disorder,"['Toothache', 'Facial pain', 'Gum pain', 'Ear pain', 'Headache', 'Mouth pain', 'Peripheral edema', 'Jaw swelling', 'Pain in gums', 'Bleeding gums', 'Mouth ulcer', 'Swollen lymph nodes']","Your teeth are made of a hard, bonelike material. Inside the tooth are nerves and blood vessels. You need your teeth for many activities you may take for granted. These include eating, speaking and even smiling. But tooth disorders are nothing to smile about. They include problems such as cavities (also known as tooth decay), infections, and injuries. The most familiar symptom of a tooth problem is a toothache. Others include worn-down or loose teeth. It\'s important that you see a dentist if you have any problems with your teeth. Fortunately, you can prevent many tooth disorders by taking care of your teeth and keeping them clean. ","['Other diagnostic radiology and related techniques', 'Treatment; facial fracture or dislocation']","['Penicillin', 'Clindamycin', 'Benzocaine Topical', 'Clove', 'Menthol-Phenol Topical', 'Glubionate Calcium', 'Cephalothin']"
417,Heart attack,"['Sharp chest pain', 'Shortness of breath', 'Chest tightness', 'Nausea', 'Arm pain', 'Fainting', 'Sweating', 'Lower body pain', 'Heartburn', 'Irregular heartbeat', 'Burning chest pain', 'Increased heart rate']","Myocardial infarction (MI) or acute myocardial infarction (AMI), commonly known as a heart attack, results from the partial interruption of blood supply to a part of the heart muscle, causing the heart cells to be damaged or die. This is most commonly due to occlusion (blockage) of a coronary artery following the rupture of a vulnerable atherosclerotic plaque, which is an unstable collection of cholesterol and fatty acids and white blood cells in the wall of an artery. The resulting ischemia (restriction in blood supply) and ensuing oxygen shortage, if left untreated for a sufficient period of time, can cause damage or death (infarction) of heart muscle tissue (myocardium). ","['Electrocardiogram', 'Hematologic tests (Blood test)', 'Complete blood count (Cbc)', 'Radiographic imaging procedure', 'Plain x-ray (X ray)', 'Cardiac enzymes measurement (Cardiac enzymes test)', 'Kidney function tests (Kidney function test)']","['Aspirin', 'Nitroglycerin', 'Metoprolol', 'Clopidogrel (Plavix)', 'Heparin', 'Enoxaparin (Lovenox)', 'Isosorbide', 'Oxygen', 'Eptifibatide (Integrilin)', 'Amiodarone', 'Dopamine', 'Tenecteplase']"
418,Open wound of the abdomen,"['Sharp abdominal pain', 'Irregular belly button', 'Sweating', 'Swollen abdomen', 'Blindness']"," silver sulfadiazine topical, ","['Wound care management', 'Complete physical skin exam performed (ML)', 'Intravenous fluid replacement', 'X-ray computed tomography (Scan ct)', 'Kidney function tests (Kidney function test)', 'Suturing of wound', 'Prothrombin time assay (Prothrombin time)']","['Cefazolin', 'Silver Sulfadiazine Topical', 'Tetracycline', 'Bimatoprost Ophthalmic', 'Daptomycin', 'Papain-Urea Topical', 'Sodium Hypochlorite Topical', 'Iodine Topical', 'Fludrocortisone', 'Oxaliplatin']"
419,Fracture of the leg,"['Hip pain', 'Leg pain', 'Knee pain', 'Ankle pain', 'Problems with movement', 'Leg swelling', 'Knee swelling', 'Ankle swelling', 'Leg stiffness or tightness', 'Leg weakness', 'Knee weakness', 'Hip stiffness or tightness']"," guanfacine (intuniv), ","['Radiographic imaging procedure', 'Plain x-ray (X ray)', 'Complete blood count (Cbc)', 'Intravenous fluid replacement', 'Kidney function tests (Kidney function test)', 'Electrocardiogram', 'Electrolytes panel']","['Darifenacin (Enablex)', 'Guanfacine (Intuniv)', 'Vitamin K 1 (Mephyton)', 'Dalteparin (Fragmin)', 'Lvp Solution', 'Disopyramide', 'Plasma Protein Fraction (Plasmanate)', 'Lactobacillus Acidophilus And Bulgaricus', 'Levobunolol Ophthalmic', 'Dronedarone (Multaq)']"
420,Oral thrush (yeast infection),"['Fever', 'Nasal congestion', 'Cough', 'Skin rash', 'Sore throat', 'Abnormal appearing tongue', 'Irritable infant', 'Mouth ulcer', 'Diaper rash', 'Constipation', 'Tongue lesions', 'Mouth pain']","Candida is the scientific name for yeast. It is a fungus that lives almost everywhere, including in your body. Usually, your immune system keeps yeast under control. If you are sick or taking antibiotics, it can multiply and cause an infection. Yeast infections affect different parts of the body in different ways: Thrush is a yeast infection that causes white patches in your mouth Esophagitis is thrush that spreads to your esophagus, the tube that takes food from your mouth to your stomach. Esophagitis can make it hard or painful to swallow Women can get vaginal yeast infections, causing itchiness, pain and discharge Yeast infections of the skin cause itching and rashes Yeast infections in your bloodstream can be life-threatening Antifungal medicines eliminate yeast infections in most people. If you have a weak immune system, treatment might be more difficult. ","['Complete physical skin exam performed (ML)', 'Other diagnostic procedures (interview; evaluation; consultation)', 'Occupational therapy assessment (Speech therapy)', 'Diagnostic bronchoscopy and biopsy of bronchus', 'Other non-OR therapeutic procedures on skin and breast', 'Nonoperative urinary system measurements', 'Other respiratory therapy']","['Nystatin Topical Product', 'Fluconazole (Diflucan)', 'Clotrimazole Topical', 'Rotavirus Vaccines (Rotavirus Vaccine)', 'Gentian Violet Topical', 'Clotrimazole', 'Simethicone (Degas)', 'Amphotericin B', 'Lopinavir', 'Dapsone', 'Glycerin (Fleet)', 'Glycerin Topical']"
421,Pityriasis rosea,"['Skin rash', 'Itching of skin', 'Abnormal appearing skin', 'Skin swelling', 'Warts', 'Vaginal itching', 'Fears and phobias', 'Weight gain', 'Acne or pimples', 'Excessive appetite', 'Skin growth', 'Dry or flaky scalp']","Pityriasis rosea (also known as pityriasis rosea Gibert) is a skin rash. It is benign but may inflict substantial discomfort in certain cases. Classically, it begins with a single ""herald patch"" lesion, followed in 1 or 2 weeks by a generalized body rash lasting up to 12 weeks, however usually around 6 - 8. ","['Complete physical skin exam performed (ML)', 'Microscopic examination (bacterial smear; culture; toxicology)', 'Examination of foot', 'Biopsy', 'Ophthalmic examination and evaluation (Eye exam)', 'Other therapeutic procedures', 'HIV screen (Hiv test)']","['Diphenhydramine (Benadryl)', 'Hydroxyzine', 'Hydrocortisone Topical', 'Triamcinolone', 'Fluocinonide Topical', 'Tacrolimus Topical Product', 'Cortisone', 'Fluticasone Topical Product', 'Acitretin (Soriatane)', 'Lactic Acid Topical', 'Desonide Topical', 'Betamethasone-Clotrimazole Topical']"
422,Allergy to animals,"['Nasal congestion', 'Allergic reaction', 'Itchiness of eye', 'Cough', 'Fever', 'Sore throat', 'Smoking problems', 'Acne or pimples', 'Peripheral edema', 'Abnormal appearing skin', 'Cross-eyed', 'Wrist weakness']"," fluticasone topical product, ","['Other diagnostic procedures on skin and subcutaneous tissue', 'Influenzavirus antibody assay', 'Blood culture', 'CAT scan of head (Head ct)', 'Liver function tests (Liver test)', 'Corneal transplant', 'Procedures on spleen (Spleen operation)']","['Cetirizine (Zyrtec)', 'Fluticasone Topical Product', 'Gentamicins (Gentamicin)', 'Minocycline', 'Nicotine', 'Olopatadine Ophthalmic', 'Acyclovir', 'Epinephrine', 'Triamcinolone', 'Hydrocortisone Topical', 'Guaifenesin (Mucinex)']"
423,Orthostatic hypotension,"['Dizziness', 'Fainting', 'Weakness', 'Headache', 'Sharp chest pain', 'Feeling ill', 'Fatigue', 'Irregular heartbeat', 'Increased heart rate', 'Hurts to breath', 'Abnormal involuntary movements', 'Palpitations']","Orthostatic hypotension, also known as postural hypotension, orthostasis, and colloquially as head rush or dizzy spell, is a form of hypotension in which a person\'s blood pressure suddenly falls when standing up or stretching. Medically it is defined as a fall in systolic blood pressure of at least 20mm Hg and diastolic blood pressure of at least 10 mm Hg when a person assumes a standing position. ","['Hematologic tests (Blood test)', 'Complete blood count (Cbc)', 'Electrocardiogram', 'Radiographic imaging procedure', 'Intravenous fluid replacement', 'Glucose measurement (Glucose level)', 'Electrolytes panel']","['Midodrine', 'Fludrocortisone', 'Nortriptyline', 'Flecainide', 'Nadolol', 'Diatrizoate', 'Memantine (Namenda)', 'Dofetilide (Tikosyn)', 'Glycerin (Fleet)']"
424,Obstructive sleep apnea (OSA),"['Abnormal breathing sounds', 'Apnea', 'Sleepiness', 'Difficulty breathing', 'Fatigue', 'Insomnia', 'Shortness of breath', 'Abnormal involuntary movements', 'Weight gain', 'Difficulty in swallowing', 'Mouth dryness', 'Sweating']",Osa may refer to: ,"['Other diagnostic procedures (interview; evaluation; consultation)', 'Other therapeutic procedures on eyelids; conjunctiva; cornea', 'Ultrasonography (Ultrasound)', 'Echocardiography', 'Electroencephalogram (EEG) (Eeg)', 'Ophthalmologic and otologic diagnosis and treatment', 'Referral to home health care service']","['Zaleplon (Sonata)', 'Ropinirole', 'Oxymetazoline Nasal', 'Pramipexole (Mirapex)', 'Armodafinil (Nuvigil)', 'Ciclesonide (Omnaris)', 'Dihydroergotamine', 'Valdecoxib (Bextra)', 'Drospirenone-Estradiol', 'Cascara Sagrada']"
425,Hypokalemia,"['Vomiting', 'Nausea', 'Sharp abdominal pain', 'Dizziness', 'Sharp chest pain', 'Weakness', 'Diarrhea', 'Shortness of breath', 'Fainting', 'Fever', 'Headache', 'Loss of sensation']","Hypokalemia (American English) or hypokalaemia (British English), also hypopotassemia or hypopotassaemia (ICD-9), refers to the condition in which the concentration of potassium (K+) in the blood is low. The prefix hypo- means ""under"" (contrast with hyper-, meaning ""over""); kal- refers to kalium, the Neo-Latin for potassium, and -emia means ""condition of the blood."" ","['Hematologic tests (Blood test)', 'Complete blood count (Cbc)', 'Intravenous fluid replacement', 'Kidney function tests (Kidney function test)', 'Electrolytes panel', 'Glucose measurement (Glucose level)', 'Radiographic imaging procedure']","['Potassium Chloride', 'Sodium Polystyrene Sulfonate (Kayexalate)', 'Magnesium Sulfate', 'Adenosine', 'Dolasetron (Anzemet)', 'Reteplase', 'Potassium Phosphate-Sodium Phosphate (Neutra-Phos)', 'Posaconazole', 'Magnesium Salicylate (Magan)', 'Diphenoxylate (Lomotil)']"
426,Psoriasis,"['Skin rash', 'Itching of skin', 'Skin dryness, peeling, scaliness, or roughness', 'Skin lesion', 'Abnormal appearing skin', 'Itchy scalp', 'Irregular appearing scalp', 'Joint pain', 'Skin moles', 'Skin growth', 'Skin swelling', 'Acne or pimples']","Psoriasis /s\xc9\xb5\xcb\x88ra\xc9\xaa.\xc9\x99s\xc9\xa8s/ is an immune-mediated disease that affects the skin. It is typically a lifelong condition. There is currently no cure, but various treatments can help to control the symptoms. ","['Complete physical skin exam performed (ML)', 'Lipid panel', 'Other therapeutic procedures', 'Biopsy', 'Excision (Removal)', 'Other diagnostic procedures on skin and subcutaneous tissue', 'Excision of skin lesion']","['Clobetasol Topical', 'Calcipotriene Topical', 'Methotrexate', 'Triamcinolone', 'Betamethasone Topical Product', 'Betamethasone-Calcipotriene Topical', 'Etanercept (Enbrel)', 'Fluocinonide Topical', 'Triamcinolone Topical Product', 'Tacrolimus Topical Product', 'Salicylic Acid Topical', 'Ketoconazole']"
427,Dislocation of the shoulder,"['Shoulder pain', 'Arm pain', 'Wrist pain', 'Shoulder stiffness or tightness', 'Arm stiffness or tightness', 'Arm swelling', 'Redness in or around nose', 'Neck mass', 'Leg weakness', 'Shoulder lump or mass']",A dislocated shoulder occurs when the humerus separates from the scapula at the glenohumeral joint. The shoulder joint has the greatest range of motion of any joint in the body and as a result is particularly susceptible to dislocation and subluxation. Approximately half of major joint dislocations seen in emergency departments are of the shoulder. Partial dislocation of the shoulder is referred to as subluxation. ,"['Radiographic imaging procedure', 'Plain x-ray (X ray)', 'Application of splint (Splinting)', 'Intravenous fluid replacement', 'Physical therapy exercises (Exercises)', 'Cardiac monitoring (Cardiac monitor)', 'Magnetic resonance imaging (Mri)']","['Fentanyl', 'Midazolam (Versed)', 'Propofol', 'Tromethamine', 'Methohexital (Brevital)', 'Etomidate', 'Flumazenil', 'Oxaprozin']"
428,Intussusception,"['Sharp abdominal pain', 'Vomiting', 'Diarrhea', 'Regurgitation', 'Constipation', 'Upper abdominal pain', 'Blood in stool', 'Nausea', 'Cross-eyed', 'Itchy eyelid', 'Excessive growth', 'Emotional symptoms']",Intussusception may refer to: ,"['Radiographic imaging procedure', 'Complete blood count (Cbc)', 'Hematologic tests (Blood test)', 'X-ray computed tomography (Scan ct)', 'Intravenous fluid replacement', 'Electrolytes panel', 'Plain x-ray (X ray)']","['Meperidine (Demerol)', 'Pentobarbital', 'Trimethobenzamide (Tigan)', 'Prednisolone', 'Clindamycin', 'Metronidazole', 'Pantoprazole', 'Mecamylamine', 'Grepafloxacin (Raxar)', 'Malathion Topical', 'Gemtuzumab (Mylotarg)']"
