idx,disease,Symptom,reason,TestsAndProcedures,commonMedications
0,Panic disorder,"['Anxiety and nervousness', 'Depression', 'Shortness of breath', 'Depressive or psychotic symptoms', 'Sharp chest pain', 'Dizziness', 'Insomnia', 'Abnormal involuntary movements', 'Chest tightness', 'Palpitations', 'Irregular heartbeat', 'Breathing fast']","Panic disorder is an anxiety disorder characterized by recurring severe panic attacks. It may also include significant behavioral changes lasting at least a month and of ongoing worry about the implications or concern about having other attacks. The latter are called anticipatory attacks (DSM-IVR). Panic disorder is not the same as agoraphobia (fear of public places), although many afflicted with panic disorder also suffer from agoraphobia. Panic attacks cannot be predicted, therefore an individual may become stressed, anxious or worried wondering when the next panic attack will occur. Panic disorder may be differentiated as a medical condition, or chemical imbalance. The DSM-IV-TR describes panic disorder and anxiety differently. Whereas anxiety is preceded by chronic stressors which build to reactions of moderate intensity that can last for days, weeks or months, panic attacks are acute events triggered by a sudden, out-of-the-blue cause: duration is short and symptoms are more intense. Panic attacks can occur in children, as well as adults. Panic in young people may be particularly distressing because children tend to have less insight about what is happening, and parents are also likely to experience distress when attacks occur. ","['Psychotherapy', 'Mental health counseling', 'Electrocardiogram', 'Depression screen (Depression screening)', 'Toxicology screen', 'Psychological and psychiatric evaluation and therapy']","['Lorazepam', 'Alprazolam (Xanax)', 'Clonazepam', 'Paroxetine (Paxil)', 'Venlafaxine (Effexor)', 'Mirtazapine', 'Buspirone (Buspar)', 'Fluvoxamine (Luvox)', 'Imipramine', 'Desvenlafaxine (Pristiq)', 'Clomipramine', 'Acamprosate (Campral)']"
1,Vocal cord polyp,"['Hoarse voice', 'Sore throat', 'Difficulty speaking', 'Cough', 'Nasal congestion', 'Throat swelling', 'Diminished hearing', 'Lump in throat', 'Throat feels tight', 'Difficulty in swallowing', 'Skin swelling', 'Retention of urine']"," beclomethasone nasal product, ","['Tracheoscopy and laryngoscopy with biopsy', 'Occupational therapy assessment (Speech therapy)', 'Other diagnostic procedures (interview; evaluation; consultation)', 'Physical therapy exercises (Exercises)', 'Diagnostic procedures on nose; mouth and pharynx', 'Other physical therapy and rehabilitation', 'Ophthalmologic and otologic diagnosis and treatment']","['Esomeprazole (Nexium)', 'Beclomethasone Nasal Product', 'Nicotine', 'Azelastine Nasal', 'Phenylephrine (Duramax)', 'Rabeprazole (Aciphex)', 'Vinorelbine (Navelbine)', 'Vitamin A', 'Adalimumab (Humira)', 'Rituximab']"
2,Turner syndrome,"['Groin mass', 'Leg pain', 'Hip pain', 'Suprapubic pain', 'Blood in stool', 'Lack of growth', 'Diminished hearing', 'Depression', 'Emotional symptoms', 'Elbow weakness', 'Back weakness', 'Pus in sputum']","Turner syndrome or Ullrich\xe2\x80\x93Turner syndrome (also known as ""Gonadal dysgenesis"":550), 45,X, encompasses several conditions in human females, of which monosomy X (absence of an entire sex chromosome, the Barr body) is most common. It is a chromosomal abnormality in which all or part of one of the sex chromosomes is absent or has other abnormalities (unaffected humans have 46 chromosomes, of which two are sex chromosomes). In some cases, the chromosome is missing in some cells but not others, a condition referred to as mosaicism or ""Turner mosaicism"". ","['Complete physical skin exam performed (ML)', 'Ultrasonography (Ultrasound)', 'Other diagnostic procedures (interview; evaluation; consultation)', 'Echocardiography', 'Depression screen (Depression screening)', 'Examination of breast', 'Ophthalmologic and otologic diagnosis and treatment']","['Somatropin', 'Sulfamethoxazole (Bactrim)', 'Pimecrolimus Topical', 'Hyoscyamine (A-Spas)', 'Ortho Cyclen', 'Carbamazepine', 'Ascorbic Acid', 'Nystatin Topical Product', 'Phenazopyridine (Azo)', 'Nifedipine']"
3,Cryptorchidism,"['Symptoms of the scrotum and testes', 'Swelling of scrotum', 'Pain in testicles', 'Flatulence', 'Pus draining from ear', 'Jaundice', 'Mass in scrotum', 'Lack of growth', 'White discharge from eye', 'Irritable infant']","Cryptorchidism (derived from the Greek \xce\xba\xcf\x81\xcf\x85\xcf\x80\xcf\x84\xcf\x8c\xcf\x82, kryptos, meaning hidden and \xe1\xbd\x84\xcf\x81\xcf\x87\xce\xb9\xcf\x82, orchis, meaning testicle) is the absence of one or both testes from the scrotum. It is the most common birth defect regarding male genitalia. In unique cases, cryptorchidism can develop later in life, often as late as young adulthood. About 3% of full-term and 30% of premature infant boys are born with at least one undescended testis. However, about 80% of cryptorchid testes descend by the first year of life (the majority within three months), making the true incidence of cryptorchidism around 1% overall. Cryptorchidism is distinct from monorchism the condition of having only one testicle. ","['Complete physical skin exam performed (ML)', 'Ultrasonography (Ultrasound)', 'Pelvis exam', 'Rectal examination', 'Other OR therapeutic procedures; male genital', 'Other OR therapeutic nervous system procedures', 'Occupational therapy assessment (Speech therapy)']","['Haemophilus B Conjugate Vaccine (Obsolete)', 'Hepatitis B Vaccine (Obsolete)', 'Rotavirus Vaccines (Rotavirus Vaccine)', 'Desoximetasone Topical']"
4,Poisoning due to ethylene glycol,"['Abusing alcohol', 'Fainting', 'Hostile behavior', 'Drug abuse', 'Depressive or psychotic symptoms', 'Sharp abdominal pain', 'Feeling ill', 'Vomiting', 'Headache', 'Depression', 'Nausea', 'Diarrhea']"," thiamine, ","['Intravenous fluid replacement', 'Hematologic tests (Blood test)', 'Toxicology screen', 'Complete blood count (Cbc)', 'Electrocardiogram', 'Glucose measurement (Glucose level)', 'Blood alcohol']","['Lorazepam', 'Thiamine', 'Naloxone (Suboxone)', 'Charcoal', 'Folic Acid', 'Famotidine', 'Haloperidol', 'Acetylcysteine', 'Trimethobenzamide (Tigan)', 'Magnesium Sulfate', 'Olanzapine (Zyprexa)']"
5,Atrophic vaginitis,"['Vaginal itching', 'Vaginal dryness', 'Painful urination', 'Involuntary urination', 'Pain during intercourse', 'Frequent urination', 'Lower abdominal pain', 'Suprapubic pain', 'Vaginal discharge', 'Blood in urine', 'Hot flashes', 'Intermenstrual bleeding']","Atrophic vaginitis (also known as vaginal atrophy or urogenital atrophy) is an inflammation of the vagina (and the outer urinary tract) due to the thinning and shrinking of the tissues, as well as decreased lubrication. This is all due to a lack of the reproductive hormone estrogen. ","['Pelvis exam', 'Examination of breast', 'Urinalysis', 'Mammography (Mammogram)', 'Rectal examination', 'Complete physical skin exam performed (ML)', 'Pap smear']","['Estrogens, Conjugated (Usp) (Premarin)', 'Estradiol', 'Nitrofurantoin', 'Raloxifene (Evista)', 'Oxybutynin', 'Tolterodine (Detrol)', 'Progesterone', 'Solifenacin (Vesicare)', 'Risedronate (Actonel)', 'Calcium Citrate', 'Betamethasone-Clotrimazole Topical']"
6,Fracture of the hand,"['Hand or finger pain', 'Wrist pain', 'Hand or finger swelling', 'Arm pain', 'Wrist swelling', 'Arm stiffness or tightness', 'Arm swelling', 'Hand or finger stiffness or tightness', 'Wrist stiffness or tightness']"," disopyramide, ","['Radiographic imaging procedure', 'Plain x-ray (X ray)', 'Application of splint (Splinting)', 'Orthopedic casting', 'Traction; splints; and other wound care', 'Physical therapy exercises (Exercises)', 'Other non-OR therapeutic procedures on musculoskeletal system']","['Carteolol', 'Disopyramide']"
7,Cellulitis or abscess of mouth,"['Lip swelling', 'Sore throat', 'Toothache', 'Abnormal appearing skin', 'Skin lesion', 'Difficulty in swallowing', 'Acne or pimples', 'Dry lips', 'Facial pain', 'Mouth ulcer', 'Throat swelling', 'Skin growth']"," dexamethasone topical product, ","['Complete physical skin exam performed (ML)', 'Excision (Removal)', 'Incision and drainage (I d)', 'Biopsy', 'Wound care management', 'Culture wound', 'Other OR therapeutic procedures on nose; mouth and pharynx']","['Clindamycin', 'Dexamethasone Topical Product', 'Penicillin', 'Rivastigmine (Exelon)', 'Chlorhexidine Topical', 'Petrolatum Topical', 'Docosanol Topical', 'Sertaconazole Topical', 'Oxaprozin', 'Hydrocortisone-Iodoquinol Topical', 'Retapamulin Topical']"
8,Eye alignment disorder,"['Eye deviation', 'Diminished vision', 'Double vision', 'Cross-eyed', 'Symptoms of eye', 'Pain in eye', 'Eye moves abnormally', 'Abnormal movement of eyelid', 'Foreign body sensation in eye', 'Lack of growth', 'Irregular appearing scalp', 'Swollen lymph nodes']","When you look at an object, you\xe2\x80\x99re using several muscles to move both eyes to focus on it. If you have a problem with the muscles, the eyes don\xe2\x80\x99t work properly. There are many kinds of eye movement disorders. Two common ones are: Strabismus \xe2\x80\x93 a disorder in which the two eyes don\xe2\x80\x99t line up in the same direction. This results in \xe2\x80\x9ccrossed eyes\xe2\x80\x9d or \xe2\x80\x9cwalleye.\xe2\x80\x9d Nystagmus \xe2\x80\x93 fast, uncontrollable movements of the eyes, sometimes called \xe2\x80\x9cdancing eyes\xe2\x80\x9d Some eye movement disorders are present at birth. Others develop over time and may be associated with other problems, such as injuries. Treatments include glasses, eye muscle exercises, and surgery. There is no treatment for some kinds of eye movement disorders, such as most kinds of nystagmus. ","['Ophthalmologic and otologic diagnosis and treatment', 'Other diagnostic procedures (interview; evaluation; consultation)', 'Other therapeutic procedures on eyelids; conjunctiva; cornea', 'Other therapeutic procedures', 'Ophthalmic examination and evaluation (Eye exam)', 'Other extraocular muscle and orbit therapeutic procedures', 'Occupational therapy assessment (Speech therapy)']","['Atropine (Uaa)', 'Phenylephrine (Duramax)', 'Cyclopentolate Ophthalmic', 'Tropicamide Ophthalmic', 'Dexamethasone-Tobramycin Ophthalmic', 'Methazolamide (Mzm)', 'Fluorescein', 'Orlistat (Alli)', 'Colloidal Oatmeal Topical', 'Benzylpenicilloyl Polylysine (Pre-Pen)']"
9,Headache after lumbar puncture,"['Headache', 'Nausea', 'Back pain', 'Vomiting', 'Dizziness', 'Neck pain', 'Low back pain', 'Pain of the anus', 'Pain during pregnancy', 'Painful urination', 'Pelvic pain', 'Impotence']"," caffeine, ","['Intravenous fluid replacement', 'Complete blood count (Cbc)', 'Hematologic tests (Blood test)', 'Electrolytes panel', 'Glucose measurement (Glucose level)', 'Kidney function tests (Kidney function test)', 'Liver function tests (Liver test)']","['Hydromorphone (Dilaudid)', 'Caffeine', 'Prochlorperazine (Compro)', 'Midazolam (Versed)', 'Caffeine-Sodium Benzoate', 'Zidovudine', 'Zolmitriptan (Zomig)', 'Dexamethasone-Tobramycin Ophthalmic']"
10,Pyloric stenosis,"['Vomiting', 'Sharp abdominal pain', 'Infant spitting up', 'Vomiting blood', 'Cough', 'Arm stiffness or tightness', 'Regurgitation', 'Burning abdominal pain', 'Restlessness', 'Pain during pregnancy', 'Symptoms of infants', 'Wheezing']","Pyloric stenosis (or infantile hypertrophic pyloric stenosis or pylorostenosis) is a condition that causes severe projectile non-bilious vomiting in the first few months of life. There is narrowing (stenosis) of the opening from the stomach to the first part of the small intestine known as the duodenum, due to enlargement (hypertrophy) of the muscle surrounding this opening (the pylorus, meaning ""gate""), which spasms when the stomach empties. This hypertrophy is felt classically as an olive-shaped mass in the middle upper part or right upper quadrant of the infant\'s abdomen. In pyloric stenosis, it is uncertain whether there is a real congenital narrowing or whether there is a functional hypertrophy of the pyloric sphincter muscle. This condition typically develops in male babies in the first 2\xe2\x80\x936 weeks of life. ","['Radiographic imaging procedure', 'Hematologic tests (Blood test)', 'Complete blood count (Cbc)', 'Intravenous fluid replacement', 'Electrolytes panel', 'Glucose measurement (Glucose level)', 'Kidney function tests (Kidney function test)']","['Nizatidine (Axid)', 'Simethicone (Degas)', 'Lactulose', 'Silver Sulfadiazine Topical', 'Niacin', 'Nystatin Topical Product', 'Mecamylamine', 'Grepafloxacin (Raxar)', 'Malathion Topical', 'Gemtuzumab (Mylotarg)']"
11,Salivary gland disorder,"['Sore throat', 'Peripheral edema', 'Neck mass', 'Ear pain', 'Swollen lymph nodes', 'Throat feels tight', 'Facial pain', 'Skin swelling', 'Jaw swelling', 'Cough', 'Mouth dryness', 'Neck swelling']","The salivary glands in mammals are exocrine glands, glands with ducts, that produce saliva. They also secrete amylase, an enzyme that breaks down starch into maltose. In other organisms such as insects, salivary glands are often used to produce biologically important proteins like silk or glues, and fly salivary glands contain polytene chromosomes that have been useful in genetic research. ","['Complete physical skin exam performed (ML)', 'Other diagnostic procedures (interview; evaluation; consultation)', 'Biopsy', 'Excision (Removal)', 'Diagnostic procedures on nose; mouth and pharynx', 'Hemoglobin A1c measurement (Hemoglobin a1c test)', 'Physical therapy exercises (Exercises)']","['Meloxicam', 'Pramipexole (Mirapex)', 'Dicyclomine', 'Saliva Substitutes', 'Mequinol-Tretinoin Topical', 'Bleomycin', 'Desflurane', 'Entacapone (Comtan)', 'Biotin', 'Rocuronium', 'Cefadroxil']"
12,Osteochondrosis,"['Knee pain', 'Foot or toe pain', 'Bowlegged or knock-kneed', 'Ankle pain', 'Bones are painful', 'Knee weakness', 'Hand or finger pain', 'Elbow pain', 'Knee swelling', 'Skin moles', 'Knee lump or mass', 'Weight gain']","Osteochondrosis is a family of orthopedic diseases of the joint that occur in children and adolescents and in rapidly growing animals, particularly pigs, horses, and dogs. They are characterized by interruption of the blood supply of a bone, in particular to the epiphysis, followed by localized bony necrosis, and later, regrowth of the bone. This disorder is defined as a focal disturbance of endochondral ossification and is regarded as having a multifactorial etiology, so no one thing accounts for all aspects of this disease. ","['Plain x-ray (X ray)', 'Radiographic imaging procedure', 'Physical therapy exercises (Exercises)', 'Examination of foot', 'Other diagnostic procedures (interview; evaluation; consultation)', 'Application of splint (Splinting)', 'Physical therapy exercises; manipulation; and other procedures']","['Acebutolol', 'Botulinum Toxin Type A (Botox)']"
13,Injury to the knee,"['Knee pain', 'Knee swelling', 'Leg pain', 'Problems with movement', 'Knee stiffness or tightness', 'Leg swelling', 'Knee weakness', 'Foot or toe swelling', 'Heartburn', 'Smoking problems']",Injuries to the knee or the knee joint. ,"['Radiographic imaging procedure', 'Plain x-ray (X ray)', 'Magnetic resonance imaging (Mri)', 'Application of splint (Splinting)', 'Physical therapy exercises (Exercises)', 'Other therapeutic procedures', 'Other non-OR therapeutic procedures on musculoskeletal system']","['Chondroitin-Glucosamine', 'Cortisone', 'Piroxicam', 'Nabumetone', 'Pentazocine (Talwin)', 'Alendronate-Cholecalciferol', 'Moexipril', 'Desflurane']"
14,Metabolic disorder,"['Weight gain', 'Jaundice', 'Mouth dryness', 'Muscle pain', 'Smoking problems', 'Infant feeding problem', 'Recent weight loss', 'Problems with shape or size of breast', 'Arm stiffness or tightness', 'Underweight', 'Difficulty eating', 'Scanty menstrual flow']","Inborn errors of metabolism comprise a large class of genetic diseases involving disorders of metabolism. The majority are due to defects of single genes that code for enzymes that facilitate conversion of various substances (substrates) into others (products). In most of the disorders, problems arise due to accumulation of substances which are toxic or interfere with normal function, or to the effects of reduced ability to synthesize essential compounds. Inborn errors of metabolism are now often referred to as congenital metabolic diseases or inherited metabolic diseases. ","['Hematologic tests (Blood test)', 'Lipid panel', 'Glucose measurement (Glucose level)', 'Hemoglobin A1c measurement (Hemoglobin a1c test)', 'Complete physical skin exam performed (ML)', 'Ultrasonography (Ultrasound)', 'Mammography (Mammogram)']","['Ursodiol (Urso)', 'Exenatide (Byetta)', 'Alglucosidase Alfa (Myozyme)', 'Levocarnitine', 'Fenofibric Acid (Trilipix)', 'Raltegravir (Isentress)', 'Potassium Citrate']"
15,Vaginitis,"['Vaginal discharge', 'Vaginal itching', 'Sharp abdominal pain', 'Painful urination', 'Vaginal pain', 'Lower abdominal pain', 'Pelvic pain', 'Vaginal redness', 'Suprapubic pain', 'Pain during pregnancy', 'Vulvar irritation', 'Pain during intercourse']","Vaginitis is an inflammation of the vagina. It can result in discharge, itching and pain, and is often associated with an irritation or infection of the vulva. It is usually due to infection. The three main kinds of vaginitis are bacterial vaginosis (BV), vaginal candidiasis, and trichomoniasis. A woman may have any combination of vaginal infections at one time. The symptoms that arise vary with the infection, although there are general symptoms that all vaginitis infections have and infected women may also be asymptomatic. Testing for vaginal infections is not a part of routine pelvic exams; therefore, women should neither assume their health care providers will know of the infection, nor that they will provide appropriate treatment without their input. ","['Pelvis exam', 'Urinalysis', 'Standard pregnancy test', 'Chlamydia test', 'Examination of breast', 'Microscopic examination (bacterial smear; culture; toxicology)', 'Pap smear']","['Metronidazole', 'Fluconazole (Diflucan)', 'Metronidazole Topical Product', 'Terconazole Topical', 'Miconazole Topical Product', 'Betamethasone-Clotrimazole Topical', 'Clindamycin Topical Product', 'Tinidazole', 'Nystatin-Triamcinolone Topical', 'Cefixime (Suprax)', 'Pentosan Polysulphate Sodium (Elmiron)', 'Boric Acid Topical']"
16,Sick sinus syndrome,"['Dizziness', 'Sharp chest pain', 'Shortness of breath', 'Palpitations', 'Fainting', 'Weakness', 'Irregular heartbeat', 'Decreased heart rate', 'Increased heart rate', 'Bleeding or discharge from nipple']","Sick sinus syndrome (SSS), also called sinus node dysfunction (SND), is an umbrella term for a group of abnormal heart rhythms (arrhythmias) presumably caused by a malfunction of the sinus node, the heart\'s primary pacemaker. Bradycardia-tachycardia syndrome is a variant of sick sinus syndrome in which slow arrhythmias and fast arrhythmias alternate. In recent years, the syndrome has become increasingly prevalent in dogs. The reason is unknown. ","['Electrocardiogram', 'Other diagnostic procedures (interview; evaluation; consultation)', 'Ultrasonography (Ultrasound)', 'Echocardiography', 'Lipid panel', 'Diagnostic cardiac catheterization; coronary arteriography', 'Depression screen (Depression screening)']","['Warfarin', 'Digoxin', 'Sotalol', 'Amiodarone', 'Torsemide', 'Vitamin E (Vita-E)', 'Bumetanide', 'Flecainide', 'Ibandronate (Boniva)', 'Dofetilide (Tikosyn)', 'Dopamine', 'Isosorbide Mononitrate (Ismo)']"
17,Tinnitus of unknown cause,"['Ringing in ear', 'Diminished hearing', 'Dizziness', 'Ear pain', 'Headache', 'Plugged feeling in ear', 'Itchy ear(s)', 'Frontal headache', 'Symptoms of eye', 'Hoarse voice', 'Fluid in ear', 'Neck stiffness or tightness']","Do you hear a ringing, roaring, clicking or hissing sound in your ears? Do you hear this sound often or all the time? Does the sound bother you? If you answer is yes, you might have tinnitus. Millions of people in the U.S. have tinnitus. People with severe tinnitus may have trouble hearing, working or even sleeping. Causes of tinnitus include hearing loss, exposure to loud noises or medicines you may be taking for a different problem. Tinnitus may also be a symptom of other health problems, such as allergies, high or low blood pressure, tumors and problems in the heart, blood vessels, jaw and neck. Treatment depends on the cause. Treatments may include hearing aids, sound-masking devices, medicines and ways to learn how to cope with the noise. NIH: National Institute on Deafness and Other Communication Disorders ","['Ophthalmologic and otologic diagnosis and treatment', 'Magnetic resonance imaging (Mri)', 'Other therapeutic ear procedures', 'Other physical therapy and rehabilitation', 'Diagnostic procedures on ear', 'Diagnostic procedures on nose; mouth and pharynx', 'Other OR therapeutic nervous system procedures']","['Azelastine Nasal', 'Salmeterol', 'Levocetirizine (Xyzal)', 'Ginkgo Biloba Extract (Ginkgo)', 'Iodoquinol', 'Benzalkonium Chloride Topical', 'Aluminum Sulfate-Calcium Acetate Topical', 'Magnesium Chloride', 'Dexamethasone Ophthalmic', 'Ciclesonide Nasal', 'Almotriptan (Axert)']"
18,Glaucoma,"['Diminished vision', 'Pain in eye', 'Symptoms of eye', 'Spots or clouds in vision', 'Eye redness', 'Lacrimation', 'Itchiness of eye', 'Blindness', 'Eye burns or stings', 'Foreign body sensation in eye', 'Itchy eyelid', 'Feeling cold']","Glaucoma is a term describing a group of ocular disorders with multi-factorial etiology united by a clinically characteristic intraocular pressure-associated optic neuropathy. This can permanently damage vision in the affected eye(s) and lead to blindness if left untreated. It is normally associated with increased fluid pressure in the eye (aqueous humour). The term ""ocular hypertension"" is used for people with consistently raised intraocular pressure (IOP) without any associated optic nerve damage. Conversely, the term \'normal tension\' or \'low tension\' glaucoma is used for those with optic nerve damage and associated visual field loss, but normal or low IOP. ","['Ophthalmic examination and evaluation (Eye exam)', 'Ophthalmologic and otologic diagnosis and treatment', 'Other therapeutic procedures on eyelids; conjunctiva; cornea', 'Lens and cataract procedures', 'Diagnostic procedures on eye', 'Glaucoma procedures', 'Other intraocular therapeutic procedures']","['Latanoprost', 'Bimatoprost Ophthalmic', 'Brimonidine Ophthalmic', 'Timolol', 'Travoprost (Travatan)', 'Prednisolone Ophthalmic', 'Brimonidine-Timolol Ophthalmic', 'Dorzolamide Ophthalmic', 'Brinzolamide Ophthalmic', 'Tropicamide Ophthalmic', 'Apraclonidine Ophthalmic', 'Acetazolamide (Diamox)']"
19,Eating disorder,"['Depression', 'Anxiety and nervousness', 'Depressive or psychotic symptoms', 'Decreased appetite', 'Abusing alcohol', 'Excessive appetite', 'Difficulty eating', 'Weight gain', 'Excessive anger', 'Insomnia', 'Vomiting blood', 'Acne or pimples']","Eating disorders are conditions defined by abnormal eating habits that may involve either insufficient or excessive food intake to the detriment of an individual\'s physical and mental health. Bulimia nervosa and anorexia nervosa are the most common specific forms in the United Kingdom. Other types of eating disorders include binge eating disorder and eating disorder not otherwise specified. Bulimia nervosa is a disorder characterized by binge eating and purging. Purging can include self-induce vomiting, over-exercising, and the usage of diuretics, enemas, and laxatives. Anorexia nervosa is characterized by extreme food restriction to the point of self-starvation and excessive weight loss. Though primarily thought of as affecting females (an estimated 5\xe2\x80\x9310 million being affected in the U.K.), eating disorders affect males as well. An estimated 10 \xe2\x80\x93 15% of people with eating disorders are males (Gorgan, 1999). (an estimated 1 million U.K. males being affected). Although eating disorders are increasing all over the world among both men and women, there is evidence to suggest that it is women in the Western world who are at the highest risk of developing them and the degree of westernization increases the risk. Nearly half of all Americans personally know someone with an eating disorder. The skill to comprehend the central processes of appetite has increased tremendously since leptin was discovered, and the skill to observe the functions of the brain as well. Interactions between motivational, homeostatic and self-regulatory control processes are involved in eating behaviour, which is a key component in eating disorders. ","['Psychotherapy', 'Mental health counseling', 'Depression screen (Depression screening)', 'Psychological and psychiatric evaluation and therapy', 'Occupational therapy assessment (Speech therapy)']","['Fluoxetine (Prozac)', 'Trazodone', 'Quetiapine (Seroquel)', 'Lamotrigine (Lamictal)', 'Topiramate (Topamax)', 'Venlafaxine (Effexor)', 'Aripiprazole (Abilify)', 'Minocycline', 'Benzoyl Peroxide Topical', 'Tranylcypromine (Parnate)', 'Phenelzine (Nardil)', 'Chlorpromazine (Thorazine)']"
