idx,disease,Symptom,reason,TestsAndProcedures,commonMedications
589,Jaw disorder,"['Toothache', 'Facial pain', 'Gum pain', 'Jaw swelling', 'Headache', 'Peripheral edema', 'Mouth pain', 'Neck mass', 'Symptoms of the face', 'Difficulty in swallowing', 'Pain in gums', 'Jaw pain']","The temporomandibular joint (TMJ) connects your jaw to the side of your head. When it works well, it enables you to talk, chew and yawn. For people with TMJ dysfunction, problems with the joint and muscles around it may cause Pain that travels through the face, jaw or neck Stiff jaw muscles Limited movement or locking of the jaw Painful clicking or popping in the jaw A change in the way the upper and lower teeth fit together Jaw pain may go away with little or no treatment. Treatment may include simple things you can do yourself, such as eating soft foods or applying ice packs. It may also include pain medicines or devices to insert in your mouth. In rare cases, you might need surgery. NIH: National Institute of Dental and Craniofacial Research ","['Wound care management', 'Traction; splints; and other wound care', 'Incision and drainage (I d)']","['Penicillin', 'Clindamycin', 'Chlorhexidine Topical', 'Benzoin Topical', 'Tetanus Immune Globulin, Human', 'Methenamine', 'Aztreonam', 'Voriconazole', 'Desflurane']"
590,Perirectal infection,"['Pain of the anus', 'Mass or swelling around the anus', 'Skin swelling', 'Lower body pain', 'Fluid retention', 'Skin lesion', 'Skin growth', 'Abnormal appearing skin', 'Rectal bleeding', 'Acne or pimples', 'Pain in testicles', 'Swelling of scrotum']"," zosyn, ","['Rectal examination', 'Wound care management', 'Intravenous fluid replacement', 'Kidney function tests (Kidney function test)', 'Complete physical skin exam performed (ML)', 'Incision and drainage (I d)', 'X-ray computed tomography (Scan ct)']","['Clindamycin', 'Zosyn', 'Magnesium Sulfate', 'Nitrofurazone Topical', 'Diflorasone Topical', 'Insulin, Glulisine, Human (Apidra)', 'Pramoxine Topical', 'Halobetasol Topical', 'Paricalcitol (Zemplar)', 'Ferrous Sulfate', 'Diphtheria Toxoid Vaccine (Prohibit)']"
591,Breast cyst,"['Lump or mass of breast', 'Pain or soreness of breast', 'Bleeding or discharge from nipple', 'Skin growth', 'Neck mass', 'Warts', 'Irregular belly button', 'Coughing up sputum', 'Vaginal dryness', 'Arm lump or mass']","A breast cyst is a fluid-filled sac within the breast. One breast can have one or more breast cysts. They\'re often described as round or oval lumps with distinct edges. In texture, a breast cyst usually feels like a soft grape or a water-filled balloon, but sometimes a breast cyst feels firm. ","['Examination of breast', 'Radiographic imaging procedure', 'Mammography (Mammogram)', 'Ultrasonography (Ultrasound)', 'Biopsy', 'Complete physical skin exam performed (ML)', 'Excision (Removal)']","['Triamterene', 'Telmisartan (Micardis)', 'Imipramine', 'Amantadine', 'Norethindrone (Loestrin Fe)', 'Eletriptan (Relpax)', 'Primidone']"
592,Post-traumatic stress disorder (PTSD),"['Anxiety and nervousness', 'Depression', 'Depressive or psychotic symptoms', 'Insomnia', 'Delusions or hallucinations', 'Drug abuse', 'Excessive anger', 'Temper problems', 'Abusing alcohol', 'Low self-esteem', 'Hostile behavior', 'Fears and phobias']","Posttraumatic stress disorder (PTSD) is a severe condition that may develop after a person is exposed to one or more traumatic events, such as sexual assault, serious injury or the threat of death. The diagnosis may be given when a group of symptoms such as disturbing recurring flashbacks, avoidance or numbing of memories of the event, and hyperarousal (high levels of anxiety) continue for more than a month after the traumatic event. ","['Psychotherapy', 'Mental health counseling', 'Depression screen (Depression screening)', 'Psychological and psychiatric evaluation and therapy']","['Clonazepam', 'Quetiapine (Seroquel)', 'Trazodone', 'Bupropion (Wellbutrin)', 'Fluoxetine (Prozac)', 'Risperidone', 'Lamotrigine (Lamictal)', 'Aripiprazole (Abilify)', 'Mirtazapine', 'Lithium (Li)', 'Olanzapine (Zyprexa)', 'Eszopiclone (Lunesta)']"
593,Kidney cancer,"['Kidney mass', 'Retention of urine', 'Blood in urine', 'Symptoms of the kidneys', 'Symptoms of prostate', 'Excessive urination at night', 'Involuntary urination', 'Increased heart rate', 'Drainage in throat', 'Groin mass', 'Changes in stool appearance', 'Bedwetting']",Kidney cancer is a type of cancer that starts in the cells in the kidney. ,"['Hematologic tests (Blood test)', 'Complete blood count (Cbc)', 'Radiographic imaging procedure', 'Urinalysis', 'X-ray computed tomography (Scan ct)', 'Complete physical skin exam performed (ML)', 'Ultrasonography (Ultrasound)']","['Sunitinib (Sutent)', 'Temsirolimus', 'Vincristine', 'Zoledronic Acid (Reclast)', 'Everolimus (Afinitor)', 'Filgrastim (Neupogen)', 'Doxorubicin', 'Travoprost (Travatan)', 'Dactinomycin', 'Sorafenib', 'Ioversol', 'Midodrine']"
594,Vulvar cancer,"['Back pain', 'Ache all over', 'Pelvic pain', 'Abnormal involuntary movements', 'Insomnia', 'Lump or mass of breast', 'Weakness', 'Fluid retention', 'Peripheral edema', 'Feeling ill', 'Emotional symptoms', 'Elbow weakness']","Vulvar cancer, a malignant invasive growth in the vulva, accounts for about 4% of all gynecological cancers and typically affects women in later life. It is estimated that in the United States in 2006 about 3,740 new cases will be diagnosed and about 880 women will die as a result of vulvar cancer Vulvar carcinoma is separated from vulvar intraepithelial neoplasia (VIN), a non-invasive lesion of the epithelium that can progress via carcinoma-in-situ to squamous cell cancer, and from Paget disease of the vulva. ","['Pelvis exam', 'Excision (Removal)', 'Other OR therapeutic procedures; female organs', 'Examination of breast', 'Complete physical skin exam performed (ML)', 'Depression screen (Depression screening)', 'Examination of foot']","['Docusate (Colace)', 'Polyethylene Glycol 3350 (Miralax)', 'Hydroxychloroquine (Plaquenil)', 'Sennosides, Usp (Perdiem)', 'Estradiol', 'Tiotropium (Spiriva)', 'Estrogens, Conjugated (Usp) (Premarin)', 'Doxylamine (Unisom)', 'Acebutolol', 'Fenofibric Acid (Trilipix)']"
595,Blepharitis,"['Diminished vision', 'Eye redness', 'Pain in eye', 'Itchiness of eye', 'Swollen eye', 'Symptoms of eye', 'Lacrimation', 'Spots or clouds in vision', 'Eyelid swelling', 'White discharge from eye', 'Eye burns or stings', 'Eyelid lesion or rash']","Blepharitis (/bl\xc9\x9bf\xc9\x99r\xcb\x88a\xc9\xaat\xc9\xa8s/ BLEF-\xc9\x99r-EYE-tis) is an eye condition characterized by chronic inflammation of the eyelid, the severity and time course of which can vary. Onset can be acute, resolving without treatment within 2\xe2\x80\x934 weeks (this can be greatly reduced with lid hygiene), but more generally is a long standing inflammation varying in severity. It may be classified as seborrhoeic, staphylococcal, mixed, posterior or meiobomitis, or parasitic. ","['Ophthalmic examination and evaluation (Eye exam)', 'Other therapeutic procedures on eyelids; conjunctiva; cornea', 'Ophthalmologic and otologic diagnosis and treatment', 'Lens and cataract procedures', 'Diagnostic procedures on eye']","['Erythromycin', 'Bimatoprost Ophthalmic', 'Tropicamide Ophthalmic', 'Phenylephrine (Duramax)', 'Latanoprost', 'Azithromycin Ophthalmic', 'Erythromycin Ophthalmic', 'Brimonidine Ophthalmic', 'Ocular Lubricant', 'Dexamethasone-Tobramycin Ophthalmic', 'Loteprednol-Tobramycin Ophthalmic', 'Prednisolone-Sodium Sulfacetamide Ophthalmic']"
596,Celiac disease,"['Sharp abdominal pain', 'Diarrhea', 'Regurgitation', 'Fatigue', 'Vomiting', 'Nausea', 'Allergic reaction', 'Sharp chest pain', 'Fears and phobias', 'Peripheral edema', 'Leg lump or mass', 'Constipation']","Coeliac disease (/\xcb\x88si\xcb\x90li.\xc3\xa6k/; spelled celiac disease in North America and often celiac sprue) is an autoimmune disorder of the small intestine that occurs in genetically predisposed people of all ages from middle infancy onward. Symptoms include pain and discomfort in the digestive tract, chronic constipation and diarrhoea, failure to thrive (in children), and fatigue, but these may be absent, and symptoms in other organ systems have been described. Vitamin deficiencies are often noted in people with Coeliac disease owing to the reduced ability of the small intestine to properly absorb nutrients from food. ","['Hematologic tests (Blood test)', 'Complete blood count (Cbc)', 'Complete physical skin exam performed (ML)', 'Biopsy', 'Hemoglobin A1c measurement (Hemoglobin a1c test)', 'Lipid panel', 'Upper gastrointestinal endoscopy; biopsy']","['Dicyclomine', 'Insulin, Aspart, Human (Novolog)', 'Glucagon', 'Estradiol', 'Carbenicillin', 'Disopyramide', 'Nitroprusside', 'Aloe Vera Topical', 'Ketotifen Ophthalmic']"
597,Cystitis,"['Painful urination', 'Suprapubic pain', 'Frequent urination', 'Blood in urine', 'Sharp abdominal pain', 'Back pain', 'Retention of urine', 'Side pain', 'Lower abdominal pain', 'Pelvic pain', 'Involuntary urination', 'Symptoms of bladder']","A urinary tract infection (UTI) (also known as acute cystitis or bladder infection) is an infection that affects part of the urinary tract. When it affects the lower urinary tract it is known as a simple cystitis (a bladder infection) and when it affects the upper urinary tract it is known as pyelonephritis (a kidney infection). Symptoms from a lower urinary tract include painful urination and either frequent urination or urge to urinate (or both), while those of pyelonephritis include fever and flank pain in addition to the symptoms of a lower UTI. In the elderly and the very young, symptoms may be vague or non specific. The main causal agent of both types is Escherichia coli, however other bacteria, viruses or fungi may rarely be the cause. ","['Urinalysis', 'Kidney function tests (Kidney function test)', 'Standard pregnancy test', 'Pelvis exam', 'Liver function tests (Liver test)', 'Insertion of catheter into urinary bladder', 'Rectal examination']","['Ciprofloxacin', 'Phenazopyridine (Azo)', 'Bactrim', 'Nitrofurantoin', 'Pentosan Polysulphate Sodium (Elmiron)', 'Trimethoprim', 'Solifenacin (Vesicare)', 'Darifenacin (Enablex)', 'Dimethyl Sulfoxide Topical', 'Dexlansoprazole (Dexilant)', 'Silver Protein Mild Topical', 'Flavoxate (Urispas)']"
598,Sickle cell anemia,"['Ache all over', 'Leg pain', 'Fever', 'Back pain', 'Joint pain', 'Pulling at ears', 'Temper problems', 'Muscle cramps, contractures, or spasms', 'Irregular belly button', 'Swollen tongue', 'Penis pain', 'Dry lips']","Sickle-cell disease (SCD), or sickle-cell anaemia (SCA) or drepanocytosis, is a hereditary blood disorder, characterized by red blood cells that assume an abnormal, rigid, sickle shape. Sickling decreases the cells\' flexibility and results in a risk of various complications. The sickling occurs because of a mutation in the haemoglobin gene. Individuals with one copy of the defunct gene display both normal and abnormal haemoglobin. This is an example of codominance. ","['Hematologic tests (Blood test)', 'Complete blood count (Cbc)', 'Urinalysis', 'Glucose measurement (Glucose level)', 'Other diagnostic procedures (interview; evaluation; consultation)', 'Hemoglobin A1c measurement (Hemoglobin a1c test)', 'Pelvis exam']","['Folic Acid', 'Hydroxyurea', 'Penicillin', 'Deferasirox (Exjade)', 'Deferoxamine', 'Nelfinavir (Viracept)', 'Pirbuterol (Maxair)', 'Benzylpenicilloyl Polylysine (Pre-Pen)', 'Zidovudine', 'Lamivudine', 'Factor Viii', 'Mesna']"
599,Subconjunctival hemorrhage,"['Pain in eye', 'Eye redness', 'Diminished vision', 'Symptoms of eye', 'Headache', 'Swollen eye', 'Bleeding from eye', 'Facial pain', 'Eyelid swelling', 'Blindness', 'Foreign body sensation in eye', 'Eye burns or stings']","A subconjunctival hemorrhage (or subconjunctival haemorrhage) also known as hyposphagma, is bleeding underneath the conjunctiva. The conjunctiva contains many small, fragile blood vessels that are easily ruptured or broken. When this happens, blood leaks into the space between the conjunctiva and sclera. ","['X-ray computed tomography (Scan ct)', 'CAT scan of head (Head ct)', 'Prothrombin time assay (Prothrombin time)', 'Ophthalmic examination and evaluation (Eye exam)', 'Suturing of wound', 'Blood alcohol', 'Nonoperative removal of foreign body']","['Tetracaine (One Touch)', 'Fluorescein Ophthalmic', 'Prednisolone Ophthalmic', 'Proparacaine Ophthalmic', 'Gentamicin Ophthalmic', 'Sodium Sulfacetamide Ophthalmic', 'Erythromycin Ophthalmic', 'Atropine (Uaa)', 'Cyclopentolate Ophthalmic', 'Tobramycin Ophthalmic', 'Ciprofloxacin Ophthalmic', 'Suprofen Ophthalmic']"
600,Hemorrhoids,"['Rectal bleeding', 'Pain of the anus', 'Blood in stool', 'Constipation', 'Sharp abdominal pain', 'Mass or swelling around the anus', 'Itching of the anus', 'Lower body pain', 'Melena', 'Changes in stool appearance', 'Heartburn', 'Vaginal pain']","Hemorrhoids (US English) or haemorrhoids UK /\xcb\x88h\xc9\x9bm\xc9\x99r\xc9\x94\xc9\xaadz/, are vascular structures in the anal canal which help with stool control. They become pathological or piles when swollen or inflamed. In their physiological state, they act as a cushion composed of arterio-venous channels and connective tissue. ","['Rectal examination', 'Sigmoidoscopy or colonoscopy', 'Colonoscopy and biopsy', 'Excision (Removal)', 'Biopsy', 'Prothrombin time assay (Prothrombin time)', 'Hemorrhoid procedures (Hemorrhoid operation)']","['Midazolam (Versed)', 'Docusate (Colace)', 'Hydrocortisone Topical', 'Fentanyl', 'Meperidine (Demerol)', 'Psyllium', 'Hydrocortisone-Pramoxine Topical', 'Hydrocortisone', 'Pramoxine Topical', 'Methylcellulose (Citrucel)', 'Calcium Polycarbophil (Fibercon)', 'Dibucaine Topical']"
601,Contact dermatitis,"['Skin rash', 'Itching of skin', 'Abnormal appearing skin', 'Skin lesion', 'Skin dryness, peeling, scaliness, or roughness', 'Allergic reaction', 'Skin swelling', 'Acne or pimples', 'Skin irritation', 'Swollen eye', 'Diaper rash', 'Skin moles']",Contact dermatitis is a term for a skin reaction (dermatitis) resulting from exposure to allergens (allergic contact dermatitis) or irritants (irritant contact dermatitis). Phototoxic dermatitis occurs when the allergen or irritant is activated by sunlight. ,"['Complete physical skin exam performed (ML)', 'Biopsy', 'Other diagnostic procedures on skin and subcutaneous tissue', 'Excision of skin lesion', 'Referral to home health care service', 'Other non-OR therapeutic procedures on skin and breast', 'Other gastrointestinal diagnostic procedures']","['Hydrocortisone Topical', 'Triamcinolone', 'Hydroxyzine', 'Triamcinolone Topical Product', 'Clobetasol Topical', 'Fluocinonide Topical', 'Petrolatum Topical', 'Betamethasone Topical Product', 'Desonide Topical', 'Pimecrolimus Topical', 'Betamethasone-Clotrimazole Topical', 'Desoximetasone Topical']"
602,Sinus bradycardia,"['Sharp chest pain', 'Dizziness', 'Shortness of breath', 'Palpitations', 'Increased heart rate', 'Fainting', 'Decreased heart rate', 'Weakness', 'Irregular heartbeat', 'Chest tightness', 'Fatigue', 'Feeling ill']",Sinus bradycardia is a heart rhythm that originates from the sinus node and has a rate of under 60 beats per minute. ,"['Electrocardiogram', 'Hematologic tests (Blood test)', 'Complete blood count (Cbc)', 'Radiographic imaging procedure', 'Glucose measurement (Glucose level)', 'Plain x-ray (X ray)', 'Kidney function tests (Kidney function test)']","['Adenosine', 'Atropine (Uaa)', 'Propafenone', 'Nebivolol (Bystolic)', 'Sotalol', 'Isoproterenol', 'Flecainide', 'Glucagon', 'Midodrine', 'Dopamine', 'Ibutilide', 'Methylcellulose (Citrucel)']"
603,High blood pressure,"['Sharp chest pain', 'Headache']","Hypertension (HTN) or high blood pressure, sometimes called arterial hypertension, is a chronic medical condition in which the blood pressure in the arteries is elevated. This requires the heart to work harder than normal to circulate blood through the blood vessels. Blood pressure is summarised by two measurements, systolic and diastolic, which depend on whether the heart muscle is contracting (systole) or relaxed between beats (diastole) and equate to a maximum and minimum pressure, respectively. Normal blood pressure at rest is within the range of 100-140mmHg systolic (top reading) and 60-90mmHg diastolic (bottom reading). High blood pressure is said to be present if it is persistently at or above 140/90 mmHg. ","['Hematologic tests (Blood test)', 'Complete blood count (Cbc)', 'Lipid panel', 'Glucose measurement (Glucose level)', 'Electrocardiogram', 'Hemoglobin A1c measurement (Hemoglobin a1c test)', 'Ultrasonography (Ultrasound)']","['Hydrochlorothiazide', 'Amlodipine', 'Olmesartan (Benicar)', 'Benazepril']"
604,Pelvic inflammatory disease,"['Sharp abdominal pain', 'Pelvic pain', 'Lower abdominal pain', 'Vaginal discharge', 'Nausea', 'Vomiting', 'Side pain', 'Burning abdominal pain', 'Back pain', 'Painful urination', 'Suprapubic pain', 'Intermenstrual bleeding']","Pelvic inflammatory disease (or disorder) (PID) is a term for inflammation of the uterus, fallopian tubes, and/or ovaries as it progresses to scar formation with adhesions to nearby tissues and organs. This can lead to infertility. PID is a vague term and can refer to viral, fungal, parasitic, though most often bacterial infections. PID should be classified by affected organs, the stage of the infection, and the organism(s) causing it. Although a sexually transmitted infection (STI) is often the cause, many other routes are possible, including lymphatic, postpartum, postabortal (either miscarriage or abortion) or intrauterine device (IUD) related, and hematogenous spread. Two thirds of patients with laparoscopic evidence of previous PID were not aware they had PID ","['Urinalysis', 'Hematologic tests (Blood test)', 'Complete blood count (Cbc)', 'Standard pregnancy test', 'Radiographic imaging procedure', 'Pelvis exam', 'Kidney function tests (Kidney function test)']","['Doxycycline', 'Ceftriaxone', 'Metronidazole', 'Cefoxitin', 'Iohexol (Omnipaque)', 'Diatrizoate', 'Ampicillin', 'Metronidazole Topical Product', 'Miconazole Topical Product', 'Neostigmine', 'Cefixime (Suprax)', 'Gentamicins (Gentamicin)']"
605,Liver disease,"['Sharp abdominal pain', 'Jaundice', 'Upper abdominal pain', 'Diarrhea', 'Shortness of breath', 'Nausea', 'Weakness', 'Side pain', 'Peripheral edema', 'Blood in stool', 'Unusual color or odor to urine', 'Heartburn']",Liver disease (also called hepatic disease) is a type of damage to or disease of the liver. ,"['Hematologic tests (Blood test)', 'Complete blood count (Cbc)', 'Radiographic imaging procedure', 'Glucose measurement (Glucose level)', 'Electrolytes panel', 'Kidney function tests (Kidney function test)', 'Urinalysis']","['Spironolactone', 'Lactulose', 'Ursodiol (Urso)', 'Nadolol', 'Tacrolimus (Prograf)', 'Ritonavir (Norvir)', 'Lamivudine', 'Atazanavir (Reyataz)', 'Kaletra', 'Stavudine (Zerit)', 'Pancreatin', 'Zidovudine']"
606,Chronic constipation,"['Constipation', 'Sharp abdominal pain', 'Burning abdominal pain', 'Vomiting', 'Nausea', 'Lower abdominal pain', 'Rectal bleeding', 'Blood in stool', 'Pain of the anus', 'Retention of urine', 'Stomach bloating', 'Changes in stool appearance']"," docusate (colace), ","['Radiographic imaging procedure', 'Hematologic tests (Blood test)', 'Complete blood count (Cbc)', 'Plain x-ray (X ray)', 'Urinalysis', 'Glucose measurement (Glucose level)', 'Kidney function tests (Kidney function test)']","['Polyethylene Glycol 3350 (Miralax)', 'Docusate (Colace)', 'Magnesium Citrate', 'Bisacodyl (The Magic Bullet)', 'Lactulose', 'Glycerin (Fleet)', 'Psyllium', 'Sennosides, Usp (Perdiem)', 'Mineral Oil (Stye)', 'Guar Gum', 'Benzylpenicilloyl Polylysine (Pre-Pen)']"
607,Thyroid cancer,"['Fatigue', 'Difficulty in swallowing', 'Neck mass', 'Leg weakness', 'Stiffness all over', 'Neck swelling', 'Swollen lymph nodes', 'Arm weakness', 'Delusions or hallucinations']",Thyroid cancer is a thyroid neoplasm that originates from follicular or parafollicular thyroid cells and is malignant. ,"['Hematologic tests (Blood test)', 'Complete physical skin exam performed (ML)', 'Ultrasonography (Ultrasound)', 'Biopsy', 'Therapeutic radiology for cancer treatment (Irradiation)', 'Hemoglobin A1c measurement (Hemoglobin a1c test)', 'Excision (Removal)']","['Thyroxine (Synthroid)', 'Triiodothyronine (Cytomel)', 'Risedronate (Actonel)', 'Thyroid (Usp) (Armour Thyroid)', 'Paricalcitol (Zemplar)', 'Doxorubicin', 'Carboplatin', 'Miglitol (Glyset)', 'Thyrotropin Alfa (Usp) (Thyrogen)', 'Eflornithine Topical']"
608,Flu,"['Fever', 'Cough', 'Sore throat', 'Nasal congestion', 'Ache all over', 'Flu-like syndrome', 'Headache', 'Vomiting', 'Chills', 'Coryza', 'Nausea', 'Diarrhea']","Influenza, commonly known as ""the flu"", is an infectious disease of birds and mammals caused by RNA viruses of the family Orthomyxoviridae, the influenza viruses. The most common symptoms are chills, fever, runny nose, sore throat, muscle pains, headache (often severe), coughing, weakness/fatigue and general discomfort. Although it is often confused with other influenza-like illnesses, especially the common cold, influenza is a more severe disease caused by a different type of virus. Influenza may produce nausea and vomiting, particularly in children, but these symptoms are more common in the unrelated gastroenteritis, which is sometimes inaccurately referred to as ""stomach flu"" or ""24-hour flu"". ","['Plain x-ray (X ray)', 'Influenzavirus antibody assay', 'Intravenous fluid replacement', 'Blood culture', 'Nebulizer therapy']","['Oseltamivir (Tamiflu)', 'Robitussin Ac', 'Robitussin Dm', 'Zanamivir (Relenza)', 'Amantadine']"
609,Friedrich ataxia,"['Ear pain', 'Flatulence', 'Peripheral edema', 'Wheezing', 'Arm weakness', 'Arm pain', 'Cough', 'Shoulder swelling', 'Vulvar sore', 'Knee lump or mass', 'Back stiffness or tightness', 'Itchy eyelid']","Friedreich\'s ataxia is an inherited disease that damages your nervous system. The damage affects your spinal cord and the nerves that control muscle movement in your arms and legs. Symptoms usually begin between the ages of 5 and 15. The main symptom is ataxia, which means trouble coordinating movements. Specific symptoms include Difficulty walking Muscle weakness Speech problems Involuntary eye movements Scoliosis Heart palpitations People with Friedreich\'s ataxia usually need a wheelchair 15 to 20 years after symptoms first appear. In severe cases, people become incapacitated. There is no cure. You can treat symptoms with medicines, braces, surgery and physical therapy. NIH: National Institute of Neurological Disorders and Stroke ","['Echocardiography', 'Ultrasonography (Ultrasound)', 'Pelvis exam', 'Electrocardiogram', 'Corneal transplant', 'Transurethral resection of prostate (TURP) (Turp)', 'Coronary thrombolysis']","['Fluticasone Nasal Product', 'Albuterol', 'Oxcarbazepine (Trileptal)', 'Sildenafil (Viagra)', 'Polyethylene Glycol 3350 (Miralax)', 'Digoxin', 'Omeprazole', 'Air', 'Mecamylamine', 'Troleandomycin', 'Indium Oxyquinoline In-111 (Indium In-111 Oxyquinoline)']"
610,Tic (movement) disorder,"['Abnormal involuntary movements', 'Headache', 'Abnormal movement of eyelid', 'Seizures', 'Depressive or psychotic symptoms', 'Symptoms of eye', 'Problems with movement', 'Cramps and spasms', 'Excessive anger', 'Stiffness all over', 'Groin pain', 'Temper problems']","Disorders characterized by recurrent TICS that may interfere with speech and other activities. Tics are sudden, rapid, nonrhythmic, stereotyped motor movements or vocalizations which may be exacerbated by stress and are generally attenuated during absorbing activities. Tic disorders are distinguished from conditions which feature other types of abnormal movements that may accompany general medical conditions. (From DSM-IV, 1994) ","['Psychotherapy', 'Mental health counseling', 'Other diagnostic procedures (interview; evaluation; consultation)', 'Magnetic resonance imaging (Mri)', 'Electroencephalogram (EEG) (Eeg)', 'Ophthalmic examination and evaluation (Eye exam)', 'Other diagnostic radiology and related techniques']","['Clonidine', 'Guanfacine (Intuniv)', 'Methylphenidate', 'Risperidone', 'Dexmethylphenidate (Focalin)', 'Atomoxetine (Strattera)', 'Oxcarbazepine (Trileptal)', 'Mebendazole', 'Clomipramine', 'Fludrocortisone', 'Paliperidone (Invega)']"
611,Skin polyp,"['Skin moles', 'Skin lesion', 'Abnormal appearing skin', 'Skin growth', 'Acne or pimples', 'Itching of skin', 'Skin swelling', 'Change in skin mole size or color', 'Warts', 'Skin dryness, peeling, scaliness, or roughness', 'Irregular appearing scalp', 'Skin irritation']"," tretinoin topical, ","['Complete physical skin exam performed (ML)', 'Excision (Removal)', 'Biopsy', 'Excision of skin lesion', 'Wound care management', 'Other diagnostic procedures on skin and subcutaneous tissue', 'Other therapeutic procedures']","['Tretinoin Topical', 'Benzoyl Peroxide Topical', 'Ciclopirox Topical', 'Salicylic Acid Topical', 'Aluminum Chloride Hexahydrate Topical', 'Hydroquinone Topical', 'Adapalene Topical', 'Benzoyl Peroxide-Clindamycin Topical', 'Desoximetasone Topical', 'Imiquimod Topical', 'Azelaic Acid Topical']"
