idx,disease,Symptom,reason,TestsAndProcedures,commonMedications
199,Acute glaucoma,"['Diminished vision', 'Pain in eye', 'Symptoms of eye', 'Eye redness', 'Spots or clouds in vision', 'Foreign body sensation in eye', 'Itchiness of eye', 'Blindness', 'Lacrimation', 'Double vision', 'Eye burns or stings']","Glaucoma is a term describing a group of ocular disorders with multi-factorial etiology united by a clinically characteristic intraocular pressure-associated optic neuropathy. This can permanently damage vision in the affected eye(s) and lead to blindness if left untreated. It is normally associated with increased fluid pressure in the eye (aqueous humour). The term ""ocular hypertension"" is used for people with consistently raised intraocular pressure (IOP) without any associated optic nerve damage. Conversely, the term \'normal tension\' or \'low tension\' glaucoma is used for those with optic nerve damage and associated visual field loss, but normal or low IOP. ","['Ophthalmic examination and evaluation (Eye exam)', 'Other therapeutic procedures on eyelids; conjunctiva; cornea', 'Other intraocular therapeutic procedures', 'Diagnostic procedures on eye', 'Excision (Removal)', 'Other extraocular muscle and orbit therapeutic procedures', 'Lens and cataract procedures']","['Brimonidine Ophthalmic', 'Timolol', 'Latanoprost', 'Bimatoprost Ophthalmic', 'Prednisolone Ophthalmic', 'Travoprost (Travatan)', 'Pilocarpine Ophthalmic', 'Acetazolamide (Diamox)', 'Apraclonidine Ophthalmic', 'Dorzolamide Ophthalmic', 'Proparacaine Ophthalmic', 'Prednisolone']"
200,Open wound of the chest,"['Sharp chest pain', 'Drug abuse', 'Lip swelling']"," diphtheria toxoid vaccine / tetanus toxoid vaccine, ","['Wound care management', 'Radiographic imaging procedure', 'Plain x-ray (X ray)', 'Intravenous fluid replacement', 'Complete physical skin exam performed (ML)', 'Electrocardiogram', 'Kidney function tests (Kidney function test)']","['Tetanus Toxoid Vaccine (Adacel)', 'Cefazolin', 'Ketorolac Ophthalmic Product', 'Codeine', 'Iohexol (Omnipaque)', 'Sodium Bicarbonate']"
201,Dislocation of the patella,"['Knee pain', 'Knee swelling', 'Fluid retention', 'Problems during pregnancy', 'Knee stiffness or tightness']","Luxating patella (or trick knee, subluxation of patella, floating patella, or floating kneecap) is a condition in which the patella, or kneecap, dislocates or moves out of its normal location. ","['Radiographic imaging procedure', 'Plain x-ray (X ray)', 'Physical therapy exercises (Exercises)', 'Application of splint (Splinting)', 'Magnetic resonance imaging (Mri)', 'Arthroscopy', 'Treatment; fracture or dislocation of lower extremity (other than hip or femur)']","['Propofol', 'Cefoxitin', 'Ketamine', 'Tetracycline', 'Thyroid (Usp) (Armour Thyroid)']"
202,Sciatica,"['Back pain', 'Leg pain', 'Low back pain', 'Hip pain', 'Lower body pain', 'Loss of sensation', 'Problems with movement', 'Paresthesia', 'Leg weakness', 'Back cramps or spasms', 'Leg cramps or spasms', 'Unusual color or odor to urine']","Sciatica (/sa\xc9\xaa\xcb\x88\xc3\xa6t\xc9\xaak\xc9\x99/; sciatic neuritis, sciatic neuralgia, or lumbar radiculopathy) is a set of symptoms including pain that may be caused by general compression or irritation of one of five spinal nerve roots that give rise to each sciatic nerve, or by compression or irritation of the left or right or both sciatic nerves. Symptoms include lower back pain, buttock pain, and pain, numbness or weakness in various parts of the leg and foot. Other symptoms include pins and needles or tingling and difficulty in moving or controlling the leg. Typically, the symptoms are only felt on one side of the body. The pain may radiate below the knee, but does not always. ","['Radiographic imaging procedure', 'Plain x-ray (X ray)', 'Physical therapy exercises (Exercises)', 'Magnetic resonance imaging (Mri)', 'Other physical therapy and rehabilitation', 'Insertion of catheter or spinal stimulator and injection into spinal canal', 'Bone density scan']","['Cyclobenzaprine', 'Methocarbamol', 'Orphenadrine (Flexon)', 'Carisoprodol (Soma)', 'Metaxalone (Skelaxin)', 'Oxaprozin', 'Phendimetrazine', 'Hydrocortisone-Pramoxine Topical', 'Tolbutamide', 'Calcifediol', 'Alosetron (Lotronex)']"
203,Hypercalcemia,"['Weakness', 'Dizziness', 'Loss of sensation', 'Feeling ill', 'Hand or finger weakness', 'Allergic reaction', 'Arm cramps or spasms', 'Focal weakness', 'Retention of urine', 'Delusions or hallucinations', 'Irregular appearing nails', 'Leg weakness']","Hypercalcaemia (British English) or hypercalcemia (American English) is an elevated calcium (Ca+) level in the blood. (Normal range: 9\xe2\x80\x9310.5 mg/dL or 2.2\xe2\x80\x932.6 mmol/L). It can be an asymptomatic laboratory finding, but because an elevated calcium level is often indicative of other diseases, a workup should be undertaken if it persists. It can be due to excessive skeletal calcium release, increased intestinal calcium absorption, or decreased renal calcium excretion. ","['Hematologic tests (Blood test)', 'Complete blood count (Cbc)', 'Glucose measurement (Glucose level)', 'Urinalysis', 'Electrolytes panel', 'Electrocardiogram', 'Complete physical skin exam performed (ML)']","['Ergocalciferol', 'Zoledronic Acid (Reclast)', 'Tacrolimus (Prograf)', 'Potassium Citrate', 'Ibandronate (Boniva)', 'Oxcarbazepine (Trileptal)', 'Donepezil (Aricept)', 'Estradiol', 'Mefloquine', 'Doxercalciferol (Hectorol)']"
204,Stress incontinence,"['Involuntary urination', 'Frequent urination', 'Painful urination', 'Symptoms of bladder', 'Blood in urine', 'Retention of urine', 'Suprapubic pain', 'Hot flashes', 'Pelvic pain', 'Excessive urination at night', 'Weight gain', 'Intermenstrual bleeding']",Stress incontinence is a form of urinary incontinence. ,"['Pelvis exam', 'Urinalysis', 'Examination of breast', 'Complete physical skin exam performed (ML)', 'Rectal examination', 'Mammography (Mammogram)', 'Genitourinary incontinence procedures']","['Tolterodine (Detrol)', 'Oxybutynin', 'Solifenacin (Vesicare)', 'Estrogens, Conjugated (Usp) (Premarin)', 'Darifenacin (Enablex)', 'Tamoxifen', 'Mesna', 'Flavoxate (Urispas)', 'Trospium (Sanctura)', 'Flutamide']"
205,Varicose veins,"['Skin lesion', 'Leg pain', 'Peripheral edema', 'Ache all over', 'Lymphedema', 'Leg swelling', 'Leg cramps or spasms', 'Skin on leg or foot looks infected', 'Leg lump or mass']","Vericose veins are veins that have become enlarged and tortuous. The term commonly refers to the veins on the leg, although varicose veins can occur elsewhere. Veins have leaflet valves to prevent blood from flowing backwards (retrograde flow or reflux). Leg muscles pump the veins to return blood to the heart (the calf muscle pump mechanism), against the effects of gravity. When veins become varicose, the leaflets of the valves no longer meet properly, and the valves do not work (valvular incompetence). This allows blood to flow backwards and they enlarge even more. Varicose veins are most common in the superficial veins of the legs, which are subject to high pressure when standing. Besides being a cosmetic problem, varicose veins can be painful, especially when standing. Severe long-standing varicose veins can lead to leg swelling, venous eczema, skin thickening (lipodermatosclerosis) and ulceration. Life-threatening complications are uncommon. ","['Wound care management', 'Complete physical skin exam performed (ML)', 'Ultrasonography (Ultrasound)', 'Traction; splints; and other wound care', 'Debridement of wound; infection or burn', 'Application of splint (Splinting)', 'Excision (Removal)']","['Collagenase Topical', 'Mupirocin Topical', 'Petrolatum Topical', 'Silver Nitrate Topical Each', 'Collagen', 'Cellulose', 'Becaplermin Topical', 'Sodium Tetradecyl Sulfate (Sotradecol)', 'Cilostazol', 'Zinc Oxide Topical', 'Insulin Isophane (Humulin N)']"
206,Benign kidney cyst,"['Side pain', 'Sharp abdominal pain', 'Blood in urine', 'Vomiting', 'Back pain', 'Low back pain', 'Involuntary urination', 'Symptoms of the kidneys', 'Drainage in throat', 'Impotence', 'Symptoms of prostate', 'Decreased appetite']"," A cyst is a fluid-filled sac. There are two types of kidney cysts. Polycystic kidney disease (PKD) runs in families. In PKD, the cysts take the place of the normal tissue. They enlarge the kidneys and make them work poorly, leading to kidney failure. When PKD causes kidneys to fail\xe2\x80\x94which usually happens after many years\xe2\x80\x94people need dialysis or kidney transplantation. About half of people with the most common type of PKD end up with kidney failure. PKD also causes cysts in other parts of the body, such as the liver. Symptoms of PKD include Pain in the back and lower sides Headaches Urinary tract infections Blood in the urine Doctors diagnose PKD with imaging tests and family history. Treatments include medications, and, when people with PKD develop kidney failure, dialysis or kidney transplants. Acquired cystic kidney disease (ACKD) usually happens in people who are on dialysis. Unlike PKD, the kidneys are normal sized, and cysts do not form in other parts of the body. People with ACKD already have chronic kidney disease when they develop cysts. ACKD often has no symptoms. In most cases, the cysts are harmless and do not need treatment. NIH: National Institute of Diabetes and Digestive and Kidney Diseases ","['Radiographic imaging procedure', 'Urinalysis', 'Hematologic tests (Blood test)', 'X-ray computed tomography (Scan ct)', 'Complete blood count (Cbc)', 'Electrolytes panel', 'Intravenous fluid replacement']","['Tamsulosin (Flomax)', 'Pioglitazone (Actos)', 'Glucosamine', 'Tolterodine (Detrol)', 'Glimepiride', 'Tiotropium (Spiriva)', 'Nystatin Topical Product', 'Lutropin Alfa (Luveris)', 'Pyridostigmine (Mestinon)', 'Pentosan Polysulphate Sodium (Elmiron)', 'Ciclopirox Topical']"
207,Hydrocele of the testicle,"['Swelling of scrotum', 'Pain in testicles', 'Groin pain', 'Mass in scrotum', 'Lower abdominal pain', 'Retention of urine', 'Groin mass', 'Excessive urination at night', 'Blood in urine', 'Symptoms of the scrotum and testes', 'Skin growth', 'Impotence']",Accumulation of serous fluid between the layers of membrane (tunica vaginalis) covering the TESTIS in the SCROTUM. ,"['Radiographic imaging procedure', 'Urinalysis', 'Complete physical skin exam performed (ML)', 'Ultrasonography (Ultrasound)', 'Rectal examination', 'Prostate specific antigen measurement (Prostate specific antigen test)', 'Excision (Removal)']","['Simethicone (Degas)', 'Protamines (Protamine)', 'Diazoxide', 'Flurbiprofen', 'Orlistat (Alli)', 'Lenalidomide (Revlimid)', 'Tetrahydrozoline Ophthalmic', 'Ciclopirox Topical', 'Methyldopa', 'Efavirenz', 'Amantadine']"
208,Degenerative disc disease,"['Back pain', 'Low back pain', 'Leg pain', 'Neck pain', 'Hip pain', 'Shoulder pain', 'Ache all over', 'Loss of sensation', 'Arm pain', 'Lower body pain', 'Paresthesia', 'Joint pain']","Degeneration of one or more intervertebral disc(s) of the spine, often called ""degenerative disc disease"" (DDD) or ""degenerative disc disorder,"" is a condition that can be painful and can greatly affect the quality of one\'s life. While disc degeneration is a normal part of aging and for most people is not a problem, for certain individuals a degenerated disc can cause severe chronic pain if left untreated. ","['Radiographic imaging procedure', 'Magnetic resonance imaging (Mri)', 'Physical therapy exercises (Exercises)', 'Insertion of catheter or spinal stimulator and injection into spinal canal', 'Other therapeutic procedures', 'Other diagnostic procedures (interview; evaluation; consultation)', 'Other non-OR therapeutic procedures on musculoskeletal system']","['Pregabalin (Lyrica)', 'Bupivacaine', 'Carisoprodol (Soma)', 'Tizanidine', 'Iohexol (Omnipaque)', 'Nabumetone', 'Iopamidol (Isovue)', 'Oxymorphone (Opana)', 'Diclofenac Topical Product', 'Chlorzoxazone', 'Tegaserod (Zelnorm)', 'Chondroitin']"
209,Hirsutism,"['Unwanted hair', 'Unpredictable menstruation', 'Acne or pimples', 'Fatigue', 'Infertility', 'Abnormal appearing skin', 'Weight gain', 'Warts', 'Skin moles', 'Too little hair', 'Heavy menstrual flow', 'Apnea']","Hirsutism is the excessive hairiness on women in those parts of the body where terminal hair does not normally occur or is minimal - for example, a beard or chest hair. It refers to a male pattern of body hair (androgenic hair) and it is therefore primarily of cosmetic and psychological concern. Hirsutism is a medical sign rather than a disease and may be a sign of a more serious medical condition, especially if it develops well after puberty. The amount and location of the hair is measured by a Ferriman-Gallwey score. ","['Hematologic tests (Blood test)', 'Complete physical skin exam performed (ML)', 'Glucose measurement (Glucose level)', 'Examination of breast', 'Hemoglobin A1c measurement (Hemoglobin a1c test)', 'Lipid panel', 'Pelvis exam']","['Eflornithine Topical', 'Spironolactone', 'Ortho Cyclen', 'Hydroquinone Topical', 'Adapalene Topical', 'Tretinoin Topical', 'Modicon', 'Betamethasone Topical Product', 'Doxepin Topical', 'L-Methylfolate']"
210,Dislocation of the foot,"['Foot or toe pain', 'Vomiting', 'Ankle pain', 'Knee weakness', 'Elbow weakness', 'Elbow cramps or spasms', 'Eye strain', 'Low back weakness', 'Wrist weakness', 'Underweight', 'Feeling hot and cold', 'Muscle swelling']"," cortisone, ","['Plain x-ray (X ray)', 'Radiographic imaging procedure', 'Application of splint (Splinting)', 'Intravenous fluid replacement', 'Kidney function tests (Kidney function test)', 'Suturing of wound', 'Electrocardiogram']","['Zosyn', 'Cortisone', 'Pramipexole (Mirapex)', 'Gentamicin Ophthalmic', 'Amiodarone', 'Povidone Iodine Topical (Betadine)', 'Bupivacaine', 'Vancomycin', 'Diclofenac', 'Cefazolin', 'Celecoxib (Celebrex)']"
211,Hydronephrosis,"['Side pain', 'Sharp abdominal pain', 'Back pain', 'Nausea', 'Vomiting', 'Blood in urine', 'Suprapubic pain', 'Symptoms of the kidneys', 'Lower abdominal pain', 'Lower body pain', 'Pain in testicles', 'Symptoms of bladder']","Hydronephrosis \xe2\x80\x94 literally ""water inside the kidney"" \xe2\x80\x94 refers to distension and dilation of the renal pelvis and calyces, usually caused by obstruction of the free flow of urine from the kidney. Untreated, it leads to progressive atrophy of the kidney. In cases of hydroureteronephrosis, there is distention of both the ureter and the renal pelvis and calices. ","['Radiographic imaging procedure', 'Urinalysis', 'Hematologic tests (Blood test)', 'Complete blood count (Cbc)', 'X-ray computed tomography (Scan ct)', 'Intravenous fluid replacement', 'Kidney function tests (Kidney function test)']","['Iohexol (Omnipaque)', 'Opium', 'Meropenem', 'Ephedrine (Kie)', 'Desflurane', 'Isosorbide Dinitrate', 'Chondroitin', 'Prazosin', 'Erlotinib (Tarceva)', 'Pancrelipase (Pancrease)', 'Potassium Citrate']"
212,Diverticulosis,"['Sharp abdominal pain', 'Rectal bleeding', 'Constipation', 'Diarrhea', 'Blood in stool', 'Burning abdominal pain', 'Nausea', 'Vomiting', 'Lower abdominal pain', 'Melena', 'Upper abdominal pain', 'Heartburn']","Diverticulosis, also known as ""diverticular disease"", is the condition of having diverticula in the colon, which are outpocketings of the colonic mucosa and submucosa through weaknesses of muscle layers in the colon wall. These are more common in the sigmoid colon, which is a common place for increased pressure. This is uncommon before the age of 40, and increases in incidence after that age. ","['Sigmoidoscopy or colonoscopy', 'Complete blood count (Cbc)', 'X-ray computed tomography (Scan ct)', 'Colonoscopy and biopsy', 'Urinalysis', 'Glucose measurement (Glucose level)', 'Intravenous fluid replacement']","['Midazolam (Versed)', 'Fentanyl', 'Meperidine (Demerol)', 'Metronidazole', 'Propofol', 'Psyllium', 'Diatrizoate', 'Lubiprostone (Amitiza)', 'Barium Sulfate', 'Methylcellulose (Citrucel)']"
213,Pain after an operation,"['Sharp abdominal pain', 'Back pain', 'Sharp chest pain', 'Headache', 'Nausea', 'Vomiting', 'Low back pain', 'Toothache', 'Leg pain', 'Neck pain', 'Side pain', 'Lower abdominal pain']","Pain is an unpleasant feeling often caused by intense or damaging stimuli, such as stubbing a toe, burning a finger, putting alcohol on a cut, and bumping the ""funny bone"". The International Association for the Study of Pain\'s widely used definition states: ""Pain is an unpleasant sensory and emotional experience associated with actual or potential tissue damage, or described in terms of such damage."" ","['Radiographic imaging procedure', 'Hematologic tests (Blood test)', 'Complete blood count (Cbc)', 'Plain x-ray (X ray)', 'Intravenous fluid replacement', 'Kidney function tests (Kidney function test)', 'Urinalysis']","['Orphenadrine (Flexon)', 'Butorphanol (Stadol)', 'Dimenhydrinate (Dramamine)', 'Chlorzoxazone', 'Lipase', 'Methotrimeprazine', 'Lyme Disease Vaccine', 'Isoxsuprine']"
214,Huntington disease,"['Constipation', 'Problems with movement', 'Depression', 'Anxiety and nervousness', 'Back pain', 'Loss of sensation', 'Sharp abdominal pain', 'Drug abuse', 'Symptoms of the face', 'Elbow weakness', 'Low back weakness', 'Excessive growth']","Huntington\'s disease (HD) is a neurodegenerative genetic disorder that affects muscle coordination and leads to cognitive decline and psychiatric problems. It typically becomes noticeable in mid-adult life. HD is the most common genetic cause of abnormal involuntary writhing movements called chorea, which is why the disease used to be called Huntington\'s chorea. ","['CAT scan of head (Head ct)', 'X-ray computed tomography (Scan ct)', 'Depression screen (Depression screening)', 'Magnetic resonance imaging (Mri)', 'Mental health counseling', 'Prothrombin time assay (Prothrombin time)', 'Corneal transplant']","['Quetiapine (Seroquel)', 'Memantine (Namenda)', 'Risperidone', 'Sertraline (Zoloft)', 'Tetrabenazine', 'Rivastigmine (Exelon)', 'Atomoxetine (Strattera)', 'Tizanidine', 'Lactulose', 'Donepezil (Aricept)', 'Mirtazapine']"
215,West Nile virus,"['Pain in eye', 'Shoulder cramps or spasms', 'Facial pain', 'Ankle pain', 'Wrist pain', 'Pain during pregnancy', 'Excessive anger', 'Joint stiffness or tightness', 'Pain or soreness of breast', 'Knee lump or mass', 'Fatigue', 'Excessive urination at night']","West Nile virus (WNV) is a mosquito-borne zoonotic arbovirus belonging to the genus Flavivirus in the family Flaviviridae. This flavivirus is found in temperate and tropical regions of the world. It was first identified in the West Nile subregion in the East African nation of Uganda in 1937. Prior to the mid-1990s, WNV disease occurred only sporadically and was considered a minor risk for humans, until an outbreak in Algeria in 1994, with cases of WNV-caused encephalitis, and the first large outbreak in Romania in 1996, with a high number of cases with neuroinvasive disease. WNV has now spread globally, with the first case in the Western Hemisphere being identified in New York City in 1999; over the next 5 years, the virus spread across the continental United States, north into Canada, and southward into the Caribbean Islands and Latin America. WNV also spread to Europe, beyond the Mediterranean Basin . WNV is now considered to be an endemic pathogen in Africa, Asia, Australia, the Middle East, Europe and in the United States, which in 2012 has experienced one of its worst epidemics. In 2012, WNV killed 286 people in the United States, with the state of Texas being hard hit by this virus, making the year the deadliest on record for the United States. ","['Corneal transplant', 'Transurethral resection of prostate (TURP) (Turp)', 'Coronary thrombolysis', 'Control of epistaxis', 'CT scan abdomen (Ct of abdomen)', 'Procedures on spleen (Spleen operation)', 'Bone marrow transplant (Bmt)']","['Air', 'Mecamylamine', 'Troleandomycin', 'Indium Oxyquinoline In-111 (Indium In-111 Oxyquinoline)', 'Pipecuronium (Arduan)', 'Grepafloxacin (Raxar)', 'Rabbit Anti-Human T-Lymphocyte Globulin (Thymoglobulin)', 'Iopanoic Acid', 'Conjugated Estrogens Topical', 'Malathion Topical', 'Gemtuzumab (Mylotarg)']"
216,Lymphoma,"['Fatigue', 'Neck mass', 'Regurgitation', 'Hoarse voice', 'Muscle pain', 'Mouth pain', 'Symptoms of the kidneys', 'Groin mass', 'Mouth ulcer', 'Stiffness all over', 'Shoulder lump or mass', 'Itchy ear(s)']","Lymphoma is a type of blood cancer that occurs when B or T lymphocytes, the white blood cells that form a part of the immune system and help protect the body from infection and disease, divide faster than normal cells or live longer than they are supposed to. Lymphoma may develop in the lymph nodes, spleen, bone marrow, blood or other organs and eventually they form a tumor. ","['Hematologic tests (Blood test)', 'Complete blood count (Cbc)', 'Glucose measurement (Glucose level)', 'Complete physical skin exam performed (ML)', 'Electrolytes panel', 'X-ray computed tomography (Scan ct)', 'Hemoglobin A1c measurement (Hemoglobin a1c test)']","['Rituximab', 'Doxorubicin', 'Cyclophosphamide', 'Vincristine', 'Dexamethasone', 'Pegfilgrastim (Neulasta)', 'Filgrastim (Neupogen)', 'Palonosetron (Aloxi)', 'Acyclovir', 'Vinblastine', 'Darbepoetin Alfa (Aranesp)', 'Bleomycin']"
217,Dermatitis due to sun exposure,"['Abnormal appearing skin', 'Skin lesion', 'Skin rash', 'Skin moles', 'Skin dryness, peeling, scaliness, or roughness', 'Irregular appearing scalp', 'Acne or pimples', 'Skin growth', 'Skin swelling', 'Symptoms of the face', 'Itchy scalp', 'Lack of growth']"," mupirocin topical, ","['Complete physical skin exam performed (ML)', 'Excision (Removal)', 'Excision of skin lesion', 'Biopsy', 'Other diagnostic procedures on skin and subcutaneous tissue', 'Wound care management', 'Other therapeutic procedures']","['Mupirocin Topical', 'Imiquimod Topical', 'Clobetasol Topical', 'Tretinoin Topical', 'Metronidazole Topical Product', 'Fluorouracil Topical', 'Silver Sulfadiazine Topical', 'Terbinafine Topical', 'Tacrolimus Topical Product', 'Desoximetasone Topical', 'Salicylic Acid Topical']"
218,Anemia due to chronic kidney disease,"['Fatigue', 'Weakness', 'Shortness of breath', 'Peripheral edema', 'Ankle swelling', 'Recent weight loss', 'Polyuria', 'Feeling cold', 'Symptoms of the kidneys', 'Melena']"," furosemide, ","['Hematologic tests (Blood test)', 'Complete blood count (Cbc)', 'Glucose measurement (Glucose level)', 'Electrolytes panel', 'Urinalysis', 'Hemoglobin A1c measurement (Hemoglobin a1c test)', 'Lipid panel']","['Darbepoetin Alfa (Aranesp)', 'Furosemide', 'Epoetin Alfa (Procrit)', 'Allopurinol', 'Digoxin', 'Ergocalciferol', 'Hydralazine', 'Isosorbide', 'Ferric Oxide, Saccharated (Venofer)', 'Sodium Bicarbonate', 'Calcitriol', 'Paricalcitol (Zemplar)']"
219,Injury to internal organ,"['Sharp abdominal pain', 'Side pain', 'Sharp chest pain', 'Rib pain', 'Ache all over', 'Back pain', 'Blood in urine', 'Retention of urine', 'Pain of the anus', 'Hurts to breath', 'Lymphedema', 'Frequent urination']"," vecuronium, ","['Radiographic imaging procedure', 'Hematologic tests (Blood test)', 'Complete blood count (Cbc)', 'X-ray computed tomography (Scan ct)', 'Plain x-ray (X ray)', 'Urinalysis', 'Intravenous fluid replacement']","['Cefoxitin', 'Vecuronium', 'Sodium Polystyrene Sulfonate (Kayexalate)', 'Sucralfate (Carafate)', 'Silodosin (Rapaflo)', 'Barium Sulfate', 'Rabies Vaccine (Obsolete)', 'Lactic Acid Topical', 'Sevelamer (Renvela)', 'Alfuzosin (Uroxatral)']"
220,Scleritis,"['Pain in eye', 'Eye redness', 'Headache', 'Lacrimation', 'Spots or clouds in vision', 'Cloudy eye', 'Symptoms of eye', 'Vaginal itching', 'Pain during pregnancy', 'Abnormal appearing skin', 'Foreign body sensation in eye', 'Abnormal involuntary movements']","Scleritis is a serious inflammatory disease that affects the white outer coating of the eye, known as the sclera. The disease is often contracted through association with other diseases of the body, such as Wegener\'s granulomatosis or rheumatoid arthritis; it can also be attained through disorders of menstruation. For this reason, scleritis occurs frequently among young women. There are three types of scleritis: diffuse scleritis (the most common), nodular scleritis, and necrotizing scleritis (the most severe). Scleritis may be the first symptom of onset of connective tissue disease. ","['Ophthalmic examination and evaluation (Eye exam)', 'Corneal transplant', 'Procedures on spleen (Spleen operation)', 'Removal of ectopic pregnancy', 'Tracheostomy; temporary and permanent', 'Diagnostic endocrine procedures', 'CT scan chest (Ct chest)']","['Prednisolone Ophthalmic', 'Timolol', 'Loteprednol-Tobramycin Ophthalmic', 'Prednisolone-Sodium Sulfacetamide Ophthalmic', 'Fluorometholone Ophthalmic', 'Nepafenac Ophthalmic', 'Fluorescein Ophthalmic', 'Brimonidine Ophthalmic', 'Tropicamide Ophthalmic', 'Erythromycin Topical Product', 'Benoxinate-Fluorescein Ophthalmic']"
221,Pterygium,"['Pain in eye', 'Symptoms of eye', 'Eye redness', 'Diminished vision', 'Itchiness of eye', 'Lacrimation', 'Foreign body sensation in eye', 'Eye burns or stings', 'Spots or clouds in vision', 'Eyelid swelling', 'Acne or pimples', 'Irregular appearing scalp']","Pterygium refers to any winglike triangular membrane occurring in the neck, eyes, knees, elbows, ankles or digits. ","['Excision (Removal)', 'Other therapeutic procedures on eyelids; conjunctiva; cornea', 'Ophthalmic examination and evaluation (Eye exam)', 'Ophthalmologic and otologic diagnosis and treatment', 'Other extraocular muscle and orbit therapeutic procedures', 'Lens and cataract procedures']","['Moxifloxacin (Avelox)', 'Prednisolone Ophthalmic', 'Loteprednol-Tobramycin Ophthalmic', 'Ocular Lubricant', 'Bimatoprost Ophthalmic', 'Fluorometholone Ophthalmic', 'Loteprednol Ophthalmic', 'Dexamethasone-Tobramycin Ophthalmic', 'Gatifloxacin (Zymar)', 'Timolol', 'Ofloxacin', 'Portia']"
